position,channelId,channelTitle,videoId,publishedAt,publishedAtSQL,videoTitle,videoDescription,tags,videoCategoryId,videoCategoryLabel,duration,durationSec,dimension,definition,caption,thumbnail_maxres,licensedContent,viewCount,likeCount,dislikeCount,favoriteCount,commentCount
1,UCyHDQ5C6z1NDmJ4g6SerW8g,maiLab,IK5BZdnqMDU,2022-09-18T16:00:18Z,"2022-09-18 16:00:18","Das Ende der Homöopathie | MAITHINK X","Der vielleicht größte Abwasserskandal aller Zeiten - ausgerechnet mit der angeblich so sanften Homöopathie. Und ein Eistee, der mit Globuli gesüßt wird, obwohl die sonst nur in der Apotheke verkauft werden. Wir führen euch durch die Abgründe der deutschen Arzneimittelregelungen - holt euch einen Eistee, macht es euch gemütlich! MAITHINK X - Die neue Staffel! JEDEN SONNTAG 22:15 auf ZDFneo oder ab 18:00 online in der ZDF Mediathek: https://kurz.zdf.de/MNT/ Erzählt allen von Homöopa Tea, JETZT BESTELLEN unter: https://homoeopatea.de/ Ansonsten geht es hier demnächst wieder mit normalen maiLab-Videos weiter, wir sind schon fleißig dabei und bald kriegt ihr auch wieder neuen Content, bei dem ihr euch wieder *heißen* Tee holen könnt :) Stay tuned, Freunde der Sonne. ► maiLab abonnieren: http://bit.ly/2kru8qh ► Instagram: https://www.instagram.com/maithink ► Twitter: https://www.twitter.com/maithi_nk maiLab wird produziert von Mai Thi Nguyen-Kim für funk (ARD & ZDF) ►YouTube: https://www.youtube.com/funkofficial ►funk Web-App: https://go.funk.net ►Facebook: https://facebook.com/funk ►https://go.funk.net/impressum","Mai Thi Nguyen-Kim,Mai Thi,mai,nguyen,mailab,lab,maithink,maithinkx,maithink x,terra x,die kleinste gemeinsame wirklichkeit,the secret life of scientists,homöopathie,globuli,arzneimittel,wassergedächtnis,wasser,gedächtnis,abwasser,skandal,dhu,hersteller,herstellung,potenziertes wasser,potenz,arnika,d12,safran,crocus,apotheke,apothekenpflicht,behörden,wisssenschaft,aufklärung",28,"Science & Technology",PT31M57S,1917,2d,hd,false,https://i.ytimg.com/vi/IK5BZdnqMDU/maxresdefault.jpg,1,1729562,83334,,0,18716
2,UCyHDQ5C6z1NDmJ4g6SerW8g,maiLab,Mt50U4_ueR0,2022-06-09T04:30:04Z,"2022-06-09 04:30:04",Affenpocken,"Ich weiß, niemand will gerade von nem neuen Virus hören. Aber durch Verdrängung werden die Sorgen ja auch nicht besser. Also, holt euch einen Tee, wir geben euch den Überblick: Wie gefährdet sind Kinder? Muss man sich impfen lassen? Sind die Affenpocken sexuell übertragbar? Und natürlich - kann das jetzt eine neue Pandemie werden? maiLab wird produziert von Mai Thi Nguyen-Kim für funk (ARD & ZDF) ►funk Web-App: https://go.funk.net ►https://go.funk.net/impressum INHALT 0:00 Intro 0:57 Achtung: Neu! 3:11 Mögliche Gründe für die Ausbreitung 5:11 Noch ein Virus? Nein, danke! 6:56 Symptome 7:12 Wie und wo man sich ansteckt 7:36 Affenpocken, Sex & Männer 10:03 Isolation 10:24 Impfungen 11:08 Medikamente 11:36 (K)eine neue Pandemie 13:14 Keksempfehlung WEITERFÜHRENDE INFOS Press Briefing des deutschen Science Media Centers https://www.sciencemediacenter.de/alle-angebote/press-briefing/details/news/affenpocken-verbreitungsdynamik-gegenmassnahmen-und-therapieoptionen/ Ausführliche Hintergründe in dieser Folge des Podcasts Pandemia https://viertausendhertz.de/pan43/ fortlaufend aktualisierte Infos bei der Deutschen Aidshilfe https://www.aidshilfe.de/affenpocken FAQ des RKI https://www.rki.de/SharedDocs/FAQ/Affenpocken/affenpocken_gesamt.html QUELLEN Stellungnahme der Fachgesellschaften zu Affenpocken vom 27.5.2022 https://www.dgi-net.de/gemeinsame-stellungnahme-zum-ausbruch-von-affenpocken-in-deutschland/?print=pdf Für den Zeitraum zwischen 13.5. und 2.6. meldet die WHO 780 laborbestätigte Fälle in Ländern, in denen das Virus nicht endemisch ist https://www.who.int/emergencies/disease-outbreak-news/item/2022-DON390 Die Pocken (“Menschenpocken”) wurden 1980 von der WHO für ausgerottet erklärt https://www.who.int/health-topics/smallpox Das Affenpockenvirus wurde 1958 erstmals identifiziert - in Affen. Arita et al. (1972). Bull World Health Organ. 46(5): 625–631. https://www.ncbi.nlm.nih.gov/pmc/articles/PMC2480785/?page=1 Es gibt zwei Linien bzw. Gruppen von Affenpocken. Die westafrikanische ist weniger ansteckend und zeigt seltener schwer Verläufe als die zentralafrikanische. Beer EM und Rao VB (2019). PLoS Negl Trop Dis 13(10): e0007791. https://pubmed.ncbi.nlm.nih.gov/31618206/ Pockenimpfung schützt vor Affenpocken. Bunge et al. (2022) PLoS Negl Trop Dis 16(2): e0010141. https://journals.plos.org/plosntds/article?id=10.1371/journal.pntd.0010141#pntd.0010141.ref002 Verstärkter Erregertausch zwischen Tierarten durch schrumpfende Lebensräume und Klimawandel. Carlson et al. (2022), Nature https://www.nature.com/articles/s41586-022-04788-w Zu dem Thema Beitrag im DLF https://www.deutschlandfunk.de/klima-tiere-zoonosen-welche-verantwortung-der-mensch-fuer-100.html Erhöhtes Risiko für schwere Verläufe bei Immungeschwächten muss befürchtet werden. Bspw sind für die verwandten Kuhpocken, die normalerweise harmlos verlaufen, schwere und tödliche Verläufe bei Menschen mit eingeschränkter Immunfunktion beschrieben. Gazzani et al. (2017), Pediatr Nephrol 32(3):533-536 https://pubmed.ncbi.nlm.nih.gov/27796621/ und Duraffur et al. (2013), PLoS One https://journals.plos.org/plosone/article?id=10.1371/journal.pone.0055808 Infektionsrisiko durch Sperma vs Hautkontakt, siehe Prof. Wölfel beim Press Briefing des SMC https://www.sciencemediacenter.de/alle-angebote/press-briefing/details/news/affenpocken-verbreitungsdynamik-gegenmassnahmen-und-therapieoptionen/ Pockenimpfstoffe können auch nach der Exposition wirken. Keckler et al. (2013), Vaccine 31(45):5192-201 https://pubmed.ncbi.nlm.nih.gov/23994378/ Infos des amerikanischen CDC über die antiviralen Medikamente Tecovirimat und Brincidofovir https://www.cdc.gov/poxvirus/monkeypox/clinicians/treatment.html#Cidofovir Global Virome Project https://www.globalviromeproject.org/ BILDQUELLEN Affenpocken pro Land. By ArcMachaon - Own work, CC BY-SA 4.0, https://commons.wikimedia.org/w/index.php?curid=118196686 Interaktive Karte von Affenpocken in Europa und weltweit, Berliner Morgenpost https://interaktiv.morgenpost.de/affenpocken-virus-faelle-deutschland-welt-karte/",,28,"Science & Technology",PT13M39S,819,2d,hd,true,https://i.ytimg.com/vi/Mt50U4_ueR0/maxresdefault.jpg,1,993841,56794,,0,9141
3,UCyHDQ5C6z1NDmJ4g6SerW8g,maiLab,-NMs56pQ9EE,2022-05-05T04:30:00Z,"2022-05-05 04:30:00","Putin und die Grüne Energie","Putins Angriffskrieg gegen die Ukraine bringt nicht nur viel Leid, sondern auch die (eigentlich nicht neue) Erkenntnis: Wir müssen dringend weg von fossilen Energiequellen, nicht nur wegen der Klimakrise, sondern auch, weil uns Gas, Öl und Kohle geopolitisch abhängig und im Zweifelsfall erpressbar machen. Aber wenn Deutschland auch in einer 100% grünen Zukunft au Importe angewiesen ist, z.B. auf mit günstigem Wüstenstrom hergestellten Wasserstoff auf Saudi-Arabien - haben wir in Zukunft dann nicht dasselbe Problem IN GRÜN? Oder können wir uns doch energieautark und damit komplett unabhängig machen? Die Antwort auf beide Fragen lautet: Nein. Siehe Video. maiLab wird produziert von Mai Thi Nguyen-Kim für funk (ARD & ZDF) ►funk Web-App: https://go.funk.net ►https://go.funk.net/impressum INHALT 0:00 Intro 1:58 The Circle of Life 4:27 Knackpunkt Dunkelflauten 7:45 Effizienz, Effizienz, Effizienz 11:46 “Erneuerbar” gleich “Unabhängig”? 14:15 Keksempfehlung QUELLEN & WEITERE INFOS findet ihr (wegen Zeichenlimit) hier: https://docs.google.com/document/d/14J5okndiV0ixCIUZDXWYyK_e346VLLf1wkNBgtDPT-o/ → Daraus schon mal 2 Abschnitte zu Windkraft/Umwelt und Atomkraft: Windkraft vs. Artenschutz: Das Fass haben wir nicht aufgemacht, um den Rahmen des Videos nicht zu sprengen, aber wir wollten wenigsten verlässliche Quellen verlinken, bei denen ihr euch informieren könnt: Windkraft und Artenschutz: So will die Bundesregierung den Konflikt lösen - Science Media Center, 14.04.2022: https://www.sciencemediacenter.de/alle-angebote/science-response/details/news/windkraft-und-artenschutz-so-will-die-bundesregierung-den-konflikt-loesen/ Press Briefing mit Transkript: Was bedeutet der Windkraftausbau für den Artenschutz? Politische Pläne und wissenschaftliche Perspektiven, Science Media Center, 14.01.2022: https://www.sciencemediacenter.de/alle-angebote/press-briefing/details/news/was-bedeutet-der-windkraftausbau-fuer-den-artenschutz-politische-plaene-und-wissenschaftliche-perspektiven/ Generell ist es wichtig, Klimaschutz nicht getrennt von Natur- und Artenschutz zu betrachten, da es dann doch Bereiche gibt, wo sich beide Ziele im Weg stehen können. Kurze Übersicht über mögliche Lösungen: https://www.spektrum.de/news/schwarze-rotorblaetter-verringern-vogelsterben/1763028 Atomkraft Super spannendes Thema, zu dem man problemlos ein ganzes Video machen könnte. Hätte hier nicht nur den Rahmen gesprengt, sondern ist für den Fokus dieses Videos am Ende nicht relevant - in aller Kürze und Unvollständigkeit aus folgenden Gründen: Atomkraftwerke (AKWs) haben aus technischen Gründen eine bestimmt Laufzeit. Nach z.B. 40 Jahren Betrieb müssen sie aus Sicherheitsgründen ausgeschaltet werden. Im Einzelfall kann man entscheiden, ob eine Verlängerung sicher genug und damit möglich ist oder nicht. In Deutschland sind die AKW-Betreiber selbst gegen eine Verlängerung - das heißt, man müsste - falls man Atomkraft als “grüne”, wenn auch nicht erneuerbare Energiequelle unserem Energiemix hinzufügen wollte - neue AKWs bauen. (Wer also für eine “Verlängerung von Atomkraft ist, ist genau genommen für eine “Renaissance”, also einen Wiederaufbau.) Das Bauen dauert allerdings Jahre bis Jahrzehnte. Ansätze, das zu verschnellern, z.B. durch kleinere, modulare AKWs, sind auch gerade erst in the making und im Falle eines Erfolgs auch nur Stoff für die Zukunft. Sowohl Befürworter als auch Gegner sind sich zumindest darüber einig, dass man erst ab der zweiten Jahrhunderthälfte (also grob an 2050) neuen AKWs nutzen könnte. (https://www.sciencemediacenter.de/alle-angebote/press-briefing/details/news/neue-diskussionen-um-atomkraftwerke-muss-die-welt-kernkaft-nutzen-um-den-klimawandel-zu-beschraenken/) Anders gesagt: Für die akute Klimadebatte (und Russland-Debatte) käme eine Verlängerung der Atomkraft ohnehin zu spät. Es bleibt die Frage, ob es richtig war, die AKWs vor Laufzeitende auszuschalten oder ob man die Laufzeit nicht wenigstens hätte ausreizen sollen, bzw. die aktuell noch laufenden entsprechend “auslaufen” zu lassen, anstatt sie frühzeitig zu schließen. Aber selbst wenn Deutschland nicht ausgestiegen wäre, hätte unsere Atomkraft das im Video angesprochene Problem (Deutschland kann nicht genug grüne Energie erzeugen) auch nicht gelöst, weil ihr Anteil dafür auch nicht groß genug war/ist.",,28,"Science & Technology",PT15M21S,921,2d,hd,true,https://i.ytimg.com/vi/-NMs56pQ9EE/maxresdefault.jpg,1,929302,64304,,0,8204
4,UCyHDQ5C6z1NDmJ4g6SerW8g,maiLab,-9OvNz7NESQ,2021-11-25T07:48:24Z,"2021-11-25 07:48:24","Corona-Endlosschleife | Kommen wir da jemals wieder raus?","Ja, aber nur, wenn wir verstehen, warum diese vierte Welle anders ist als die bisherigen. Nur dann können wir JETZT richtig handeln. Schlachtplan gegen das Virus: Die Impflücke so schnell und so vollständig wie möglich schließen Geimpfte so schnell wie möglich boostern Bis dahin - Flatten The Curve, mit der ganzen Käseplatte* *siehe Video maiLab wird produziert von Mai Thi Nguyen-Kim für funk (ARD & ZDF) ►funk Web-App: https://go.funk.net ►https://go.funk.net/impressum INHALT 0:00 Intro 0:48 Was bisher geschah 3:26 Impfen ist der beste Käse 5:09 Warum ist gerade alles so scheiße? 8:04 Die vierte Welle muss nicht die letzte sein 9:55 #FlattenTheCurve is back! 11:26 Hass ist ein Virus - Steckt euch nicht an. QUELLEN & WEITERE INFOS Corona geht gerade erst los | maiLab: https://youtu.be/3z0gnXgK8Do (April 2020) u.a. mit den Themen: Allgemeine Basics zur Pandemiebekämpfung (Containment, Mitigation); Prinzip von Flatten The Curve; Reproduktionszahl R; Warum Flatten The Curve nicht reicht; Die Bedeutung von Kontaktverfolgung Quellen findet ihr in der Videobeschreibung zu “Corona geht gerade erst los” Das Käsescheibenmodell: https://zdfheute-stories-scroll.zdf.de/corona-massnahmen-kaesemodell/index.html Wie entstehen Coronavirus-Varianten – und wie gefährlich sind sie? Übersicht von “Zusammen gegen Corona” (Bundesgesundheitsministerium): https://www.zusammengegencorona.de/informieren/basiswissen-zum-coronavirus/wie-gefaehrlich-sind-die-coronavirus-mutationen/ Was die Delta-Variante so ansteckend macht | Deutsches Ärzteblatt: https://www.aerzteblatt.de/nachrichten/128503/Was-die-Delta-Variante-so-ansteckend-macht So endet Corona | maiLab: https://youtu.be/pGJEVXvOcRY (Januar 2021) u.a. mit den Themen: Herdenimmunität; Warum die Impfungen könnten VORERST weniger ändern als erwartet; Sterilisierende Immunität; der endemische Zustand nach der Pandemie bzw. wie ein tödliches Virus zur harmlosen Erkältung werden kann; was “Mit Corona leben” wirklich bedeutet 7 kritische Fragen zur Impfung | maiLab: https://youtu.be/a_NpJU12_LA (Februar 2021) - Warum ging die Impfstoffentwicklung so schnell? - Ist der AstraZeneca-Impfstoff gut genug? - Können genbasierte Impfstoffe mein Erbgut verändern? - Was ist mit seltenen, aber schweren Nebenwirkungen? - Was ist mit Langzeitfolgen? (Narkolepsie) - Helfen die Impfungen gegen neue Virusmutanten? - Sollten Geimpfte mehr Freiheiten bekommen? Zweiter COVID-19-Winter in Deutschland: Diskussion über Maßnahmen zum Bevölkerungsschutz auf Basis von aktuellem Strategiepapier: https://www.sciencemediacenter.de/alle-angebote/press-briefing/details/news/zweiter-covid-19-winter-in-deutschland-diskussion-ueber-massnahmen-zum-bevoelkerungsschutz-auf-basis-von-aktuellem-strategiepapier/ (Hieraus Zitat von Prof. Dr. Viola Priesemannzur nachlassenden Impfwirkung) Gesundheitsminister Jens Spahn “Geimpft, genesen oder gestorben”: https://youtu.be/Zzj9RflT2ic RKI-Chef Lothar Wieler am 17.11.21 zur aktuellen Coronalage: https://youtu.be/lH-gpVGJRd8?t=916","mai thi nguyen-kim,mai thi,nguyen kim,nguyen,mai,mailab,maithink,maithink x,maithinkx,terra x,terrax,kleinste gemeinsame wirklichkeit,corona,covid,covid-19,sars-cov-2,delta,impfung,impfen,geimpft,genesen,booster,boostern,impflücke,schließen,welle,vierte welle,fünfte welle,flatten the curve,kurve flachhalten,flattenthecurve,immun,immunität,herdenimmunität,pandemie,endemie,endemisch,käsescheibenmodell,käsescheiben,modell,ende,beenden,zu ende,vorbei",28,"Science & Technology",PT12M6S,726,2d,hd,false,https://i.ytimg.com/vi/-9OvNz7NESQ/maxresdefault.jpg,1,2125579,123191,,0,38823
5,UCyHDQ5C6z1NDmJ4g6SerW8g,maiLab,KEggd1S9_9Y,2021-11-14T07:00:11Z,"2021-11-14 07:00:11","Impfpflicht ist OK","Es ist 5 NACH 12. Jetzt ist nicht die Zeit für Perfektion, sondern Pragmatismus. Warum diskutieren wir noch und machen nicht einfach? INHALT 0:00 Impfpflicht - warum nicht? 4:23 Fakt 1: Die Impfung ist sicher 7:21 Fakt 2: Die Impfung schützt 8:44 Fakt 3: Die Pandemie ist noch nicht vorbei 10:23 Was jetzt zu tun ist 11:23 Liebe Regierung maiLab wird produziert von Mai Thi Nguyen-Kim für funk (ARD & ZDF) ►funk Web-App: https://go.funk.net ►https://go.funk.net/impressum ***AUSFÜHRLICHE QUELLEN HIER**** https://docs.google.com/document/d/13Q8d_HlkeB05RerjBsS-AYviZCe0c-JpziJDvEsDS3g/edit?usp=sharing (wegen Zeichenbegrenzung passt nicht alles in die Videobeschreibung) WEITERE INFOS: Christian Drosten zur aktuellen Lage (NDR Coronavirus Update, Folge 102 “SOS - Iceberg, right ahead!”: https://www.ndr.de/nachrichten/info/podcast4684.html Klares ‘Nein’ der Bundesregierung zur Impfpflicht, Bundespresskonferenz 8.11.21, Quelle Tilo Jung: https://twitter.com/TiloJung/status/1457699530925821955 Aktuelle Lage der Intensivstationen in Deutschland: https://www.sciencemediacenter.de/alle-angebote/coronavirus/corona-report/corona-report-11112021?pk_campaign=cr11112021 Die Zulassung war zwar schneller als sonst, aber nicht auf Kosten der Qualitätssicherung. Das haben wir auch zu Beginn dieses maiLab-Videos beschrieben: https://www.youtube.com/watch?v=a_NpJU12_LA Das Paul-Ehrlich-Institut beschreibt das noch einmal im Detail, hier unter der Frage “Warum können COVID-19-Impfstoffe so schnell zugelassen werden und zugleich sicher sein?“: https://www.pei.de/DE/service/faq/coronavirus/faq-coronavirus-node.html Was bedeutet die bedingte Zulassung? EU-Staaten hätten die Möglichkeit für eigene Notfallzulassungen gehabt. Sie haben stattdessen auf die bedingte Zulassung der EMA gewartet, die rigorosere Prüfung beinhaltet. Eine bedingte Zulassung (statt einer vollen Zulassung) gibt es, wenn noch Daten nachgereicht werden müssen. Z.B dazu, wie lange der Impfschutz anhält, ob die Impfung auch für Schwangere oder Immungeschwächte geeignet ist, ob man sie gleichzeitig mit anderen Impfstoffen verabreichen kann, ob sie auch für Menschen geeignet sind, die bereits durch andere Krankheiten stark geschwächt sind, oder dass die Qualität auch nach Umstellung auf Herstellung im größeren Maßstab gleichbleibend ist. Die Impfung macht auch nicht unfruchtbar, wie Martin Moder hier sehr schön beschreibt: https://youtu.be/ZA8TSvyLhg4 Spät auftretende Nebenwirkungen sind nicht zu erwarten: https://www.zdf.de/nachrichten/panorama/corona-impfstoff-langzeitschaeden-100.html Siehe dazu auch bei maiLab, Minute 14:08 “7 kritische Fragen zur Impfung: https://youtu.be/a_NpJU12_LA?t=848 Was es mit den Nachwirkungen der Pandemrix-Impfung auf sich hatte, beschreibt Lars hier ausführlich: https://lars-und-die-welt.de/2020/12/17/narkolepsie-schweinegrippe-impfung/ Über 4 Milliarden Menschen wurden bereits geimpft -- mehr als die Hälfte der Weltbevölkerung: https://www.nytimes.com/interactive/2021/world/covid-vaccinations-tracker.html Die Beobachtung von Nebenwirkung nach der Zulassung nennt sich Phase IV / Phase 4 und wurde im maiLab-Video “Wie sicher ist AstraZeneca wirklich?” beschrieben: https://youtu.be/oBLQmE-nG60 “Fakt: Noch nie gab es Impfstoffe, die nach der Zulassung so sorgfältig beoobachtet wurden wie die Coronaimpfstoffe” Ausschnitt aus MAITHINK X - Die Show (ZDF Neo) bei maiLab: Freiheit vs. Wissenschaft: https://youtu.be/ptJ-42ME3f8 (Restliche Staffel hier: https://www.zdf.de/show/mai-think-x-die-show) Die Impfung schützt, aber der Impfschutz wird über die Zeit weniger: https://twitter.com/rike_tweet/status/1458538821256196097/photo/1 Die allermeisten COVID-PatientInnen im Krankenhaus sind ungeimpft -- siehe Abbildung 20 & 21 aus dem RKI-Wochenbericht (https://www.rki.de/DE/Content/InfAZ/N/Neuartiges_Coronavirus/Situationsberichte/Wochenbericht/Wochenbericht_2021-10-28.pdf?__blob=publicationFile) Guter Twitter Thread, der verständlich erklärt, wieso es nur deswegen mehr Ipfdurchbrüche gibt, weil mehr Menschen geimpft sind: https://twitter.com/MaxCRoser/status/1447844912117043200 Wie wird Corona enden? Der Unterschied zwischen Pandemie und Endemie und warum es auch mit geimpfter Bevölkerung immer noch geäfhrlich sein kann: maiLab: So endet Corona: https://youtu.be/pGJEVXvOcRY Welche Impfstoffe wirken wie lange? Von Spektrum der Wissenschaft (Grafik im Video): https://www.spektrum.de/news/corona-impfung-welche-impfstoffe-schuetzen-wie-lange/1945216 Wichtiges Strategiepapier von ExpertInnen zur Corona-Lage in Deutschland für den kommenden Winter: https://depositonce.tu-berlin.de/bitstream/11303/13862/4/COVID_Winter_2021_2022.pdf","Booster,Die kleinste gemeinsame Wirklichkeit,Impfung,Mai Thi Nguyen-Kim,boosterimpfung,bundesregierung,corona,forschung,impfen,impfen schützt,impfpflicht,kleinste gemeinsame wirklichkeit,lab,mai,mai thi,maiLab,maithink,maithink x,maithinkx,nguyen,nguyen kim,pandemie,politik,regierung,schutz,schützt,sicherheit,wissenschaft",22,"People & Blogs",PT13M52S,832,2d,hd,true,https://i.ytimg.com/vi/KEggd1S9_9Y/maxresdefault.jpg,1,3021542,236388,,0,111200
6,UCyHDQ5C6z1NDmJ4g6SerW8g,maiLab,ptJ-42ME3f8,2021-10-24T16:01:44Z,"2021-10-24 16:01:44","Freiheit vs. Wissenschaft | MAITHINK X","Es ist Zeit für knallharten wissenschaftlichen Konsens. Für die Freiheit! Wo kann man mehr MAITHINK X - Die Show sehen? →→→ Sonntags 22:15 auf ZDFneo oder jederzeit in der ZDF Mediathek streamen (Veröffentlichung der neuen Folge immer sonntags 18:00): https://www.zdf.de/show/mai-think-x-die-show #maithinkX QUELLEN zu dieser Folge hier: https://www.maithinkx.de/folge1 Insta MAITHINK X: https://www.instagram.com/maithinkx/ Twitter MAITHINK X: https://twitter.com/maithinkx Insta Mai: https://www.instagram.com/maithink/ Twitter Mai: https://twitter.com/maithi_nk MAITHINK X - Die Show wird produziert von der bildundtonfabrik btf im Auftrag von ZDFneo maiLab wird regulär produziert von Mai Thi Nguyen-Kim für funk (ARD & ZDF) ►funk Web-App: https://go.funk.net ►https://go.funk.net/impressum","Nguyen Kim,Nguyen-Kim,cdl,chhlordioxid,corona,die kleinste gemeinsame wirklichkeit,habeck,kleinste gemeinsame wirklichkeit,klimakrise,klimawandel,konsens,lab,laschet,mai thi,mai thi nguyen-kim,maiLab,maithink,maithink x,maithink x die show,mathinkx,methdoen,methode,politik,randomisierte kontrollierte studie,wissenschaft,wissenschaftlicher konsens,wissenschaftsshow,zdf,zdf neo,zdfneo",28,"Science & Technology",PT27M44S,1664,2d,hd,true,https://i.ytimg.com/vi/ptJ-42ME3f8/maxresdefault.jpg,1,895038,77980,,0,7905
7,UCyHDQ5C6z1NDmJ4g6SerW8g,maiLab,KD2UxUpy88Q,2021-10-21T05:30:02Z,"2021-10-21 05:30:02","Es ist unfassbar.","Freunde der Sonne. Sonntag, 24.10.21, 18:00. Wir zählen auf euch! Außerdem: Terra X Wunderwelt Chemie - Sonntag 19:30 im ZDF oder hier: https://www.zdf.de/dokumentation/terra-x/wunderwelt-chemie-mit-mai-thi-nguyen-kim-100.html Insta MAITHINK X: https://www.instagram.com/maithinkx/ Twitter MAITHINK X: https://twitter.com/maithinkx Insta Mai: https://www.instagram.com/maithink/ Twitter Mai: https://twitter.com/maithi_nk maiLab wird produziert von Mai Thi Nguyen-Kim für funk (ARD & ZDF) ►funk Web-App: https://go.funk.net ►https://go.funk.net/impressum","SWR,The Secret Life Of Scientists,ZDF,ZDF neo,ZDFneo,die kleinste gemeinsame wirklichkeit,fernsehen,fernsehshow,funk,kleinste gemeinsame wirklichkeit,lab,mai,mai thi,mai thi nguyen-kim,mailab,maithink,maithink x,maithink x die show,maithinkx,mathinkx die show,nguyen,nguyen kim,show,terra x,terrax,wissenschaft,wissenschaftssendung,wissenschaftsshow",22,"People & Blogs",PT5M6S,306,2d,hd,true,https://i.ytimg.com/vi/KD2UxUpy88Q/maxresdefault.jpg,1,838476,73251,,0,3831
