position,channelId,channelTitle,videoId,publishedAt,publishedAtSQL,videoTitle,videoDescription,tags,videoCategoryId,videoCategoryLabel,duration,durationSec,dimension,definition,caption,thumbnail_maxres,licensedContent,viewCount,likeCount,dislikeCount,favoriteCount,commentCount
31,UCyHDQ5C6z1NDmJ4g6SerW8g,maiLab,u439pm8uYSk,2020-04-19T07:00:22Z,"2020-04-19 07:00:22",Virologen-Vergleich,"Wissenschaft und Medien sind so ne Sache. Man kann sich drauf verlassen, dass immer irgendwelche Artikel Wissenschaft verkürzt, überspitzt oder schlichtweg falsch darstellen. Aber sind daran nur die Journalisten schuld? Oder tragen Wissenschaftler auch zur Verwirrung bei? Schauen wir uns die Kommunikation von drei der prominentesten Virologen Deutschlands an: Professor Christian Drosten, Professor Hendrik Streeck und Professor Alexander Kekulé ► Instagram @maithink: https://www.instagram.com/maithink ► Twitter @maithi_nk: https://www.twitter.com/maithi_nk maiLab wird produziert von Mai Thi Nguyen-Kim für funk (ARD und ZDF) ►funk Web-App: https://go.funk.net ►https://go.funk.net/impressum QUELLEN UND WEITERE INFOS Podcast mit Prof. Drosten https://www.ndr.de/nachrichten/info/podcast4684.html Wissenschaftskommunikator Jean-Luc Doumont: https://www.principiae.be/X0101.php Wenn ihr selbst Wissenschaftler/innen seid und euch für Wisskomm interessiert, schaut euch mal eine seiner Lectures: https://youtu.be/IFu3jaLmse0 oder https://youtu.be/meBXuTIPJQk (Hier noch sein eingeblendeter TEDx Talk: https://youtu.be/VK74BIaxkYE) Thank god for the nerds (song) https://twitter.com/jonlajoiecomedy/status/1240325657789206529 Prof. Streeck bei Lanz (talkshow) über Motivation der Heinsberg-Studie. Darin der Kommentar über Modellrechnungen https://www.youtube.com/watch?v=VP7La2bkOMo Pressekonferenz mit Zwischenergebnissen zur Heinsberg-Studie von Prof. Streeck und Kollegen vom. 8.4.2020 https://www.youtube.com/watch?v=j4fEV3z8cPw Schriftliche Fassung der Zwischenergebnisse https://www.land.nrw/sites/default/files/asset/document/zwischenergebnis_covid19_case_study_gangelt_0.pdf Prof. Streeck erklärt im Podcast, warum er und Kollegen Zwischenergebnisse in Pressekonferenz veröffentlichten und antwortet auf Kritikpunkte https://www.br.de/mediathek/podcast/b5-thema-des-tages/virologe-streeck-es-war-wichtig-dass-die-menschen-schnell-ueber-die-heinsberg-studie-informiert-wurden/1795660 Dunkelziffer und Sterblichkeit in Deutschland Tagesschau Faktenfinder (eingeblendet) https://www.tagesschau.de/faktenfinder/hintergrund/sterblichkeit-corona-101.html Diese Studie vom 16.03. schätzt, dass die Gesamtzahl der Infizierten in China 7,1-fach höher war als die erkannte. Li et al. 2020, Science, eabb3221 https://science.sciencemag.org/content/early/2020/03/24/science.abb3221.full Diese Studie vom 31.03. nimmt als “echte Infektionssterblichkeit” den Wert aus Südkorea, wo von einer sehr niedrigen Dunkelziffer ausgegangen wurde. Berücksichtigt man die Unterschiede der Demographie (je mehr Alte es gibt, desto höher wird die Sterblichkeit ausfallen), kommt man für Deutschland auf eine Gesamtzahl von Infizierten, die 3,3-fach über der erkannten Zahl liegt. Jagodnik et al., 2020 (preprint), medarxiv, doi: 10.1101/2020.03.14.20036178 https://www.medrxiv.org/content/10.1101/2020.03.14.20036178v2.full.pdf Diese Studie vom 06.04. kommt auf eine Gesamtzahl in D 6,7-fach über der erkannten Zahl (Video mit Erklärung) https://www.uni-goettingen.de/en/606540.html. Rechnung basiert auf dieser Näherung für die “echte Infektionssterblichkeit”, die auf Kreuzfahrtschiffen und von evakuierten Menschen ermittelt wurde, die unabhängig von Symptomen getestet worden waren https://www.thelancet.com/journals/laninf/article/PIIS1473-3099(20)30243-7/fulltext Letalität wird von Drosten in Interview Anfang März auf 0.3-0.7% geschätzt https://www.bundesgesundheitsministerium.de/coronavirus/podcastreihe-coronavirus/prof-drosten.html Am 18.04. sind laut https://coronavirus.jhu.edu/map.html ~142.000 Infizierte in Deutschland gemeldet. Bei einer Gesamtzahl von 5-fach über dieser Zahl wären 0,86% der Bevölkerung bereits infiziert (und damit immun), bei einer 10-fachen 1,71%. Podcast mit Prof. Kekulé https://www.mdr.de/nachrichten/podcast/kekule-corona/kompass-104.html Volker Stollorz vom Science Media Center über Experteneinordnung im Wissenschaftsjournalismus und die Reputation von Wissenschaftlern, u.a. Kekulé https://www.radioeins.de/programm/sendungen/die_profis/archivierte_sendungen/beitraege/auswahlkriterien-im-wissenschaftsjournalismus.html Für alle, die Interesse an Wissenschaftskommunikation haben: https://www.wissenschaftskommunikation.de/ Seminare für Unis (für Studierende, Promovierende, Postdocs & Co.): https://www.nawik.de/ (Fragt bei eurer Uni nach, ob es Gelder / Töpfe für solche Fortbildungen gibt) https://www.wissenschaft-im-dialog.de/","Mai Thi Nguyen-Kim,Mai Thi,Nguyen-Kim,Mai,Nguyen,maiLab,lab,Komisch alles chemisch,komisch,alles chemisch,the secret life of scientists,quarks,terra x,drosten,christian drosten,streeck,hendrik streeck,kekule,kekulé,alexander kekule,alexander kekulé,Virologen,Virologie,Corona,Coronakrise,Epidemie,Pandemie,Virus,COVID-19,SARS-CoV-2,Wissenschaftskommunikation,Wissenschaftsjournalismus",28,"Science & Technology",PT17M36S,1056,2d,hd,true,https://i.ytimg.com/vi/u439pm8uYSk/maxresdefault.jpg,1,2654200,92957,,0,33773
32,UCyHDQ5C6z1NDmJ4g6SerW8g,maiLab,3z0gnXgK8Do,2020-04-02T07:00:00Z,"2020-04-02 07:00:00","Corona geht gerade erst los","Kitas, Schulen, Geschäfte sind geschlossen, soziale Kontakte auf ein Minimum eingeschränkt. Viele sind gerade arbeits- oder auftragslos, Andere arbeiten sich gerade kaputt, um das Land am Laufen zu halten. Wie lange müssen wir diesen Ausnahmezustand aushalten und wie können wir schnellstmöglich zur Normalität zurück kommen?So viel vorweg: Es wird länger dauern, als die meisten denken. ► maiLab abonnieren: http://bit.ly/2kru8qh ► Instagram @maithink: https://www.instagram.com/maithink ► Twitter @maithi_nk: https://www.twitter.com/maithi_nkmaiLab wird produziert von Mai Thi Nguyen-Kim für funk (ARD & ZDF) ►funk Web-App: https://go.funk.net ►https://go.funk.net/impressum QUELLEN UND WEITERE INFOS Weltweit gemeldete Covid-19-Fälle https://coronavirus.jhu.edu/map.html Die Kontaktbeschränkungen in Deutschland sollen mindestens bis nach Ostern gelten https://www.zdf.de/nachrichten/politik/coronavirus-merkel-kontaktbeschraenkungen-ueber-ostern-verlaengern-100.html Die Basisreproduktionszahl R0 gibt an, wie viele Andere ein Infizierter ohne Gegenmaßnahmen durchschnittlich ansteckt, wenn niemand immun ist. Sie ist keine Konstante, sondern ist z.B. in dicht besiedelten Regionen höher oder niedriger in Gesellschaften, in denen die Menschen aus kulturellen Gründen mehr Abstand halten. Die meisten Angaben für SARS-CoV-2 gehen von 2 bis etwas über 3. Diese Schätzung aufgrund des Ausbruchs in China kommt auf R0 zwischen 2.24 und 3.58: Zhao et al. 2020, Int J Infect Dis, 92:214-217 https://www.ncbi.nlm.nih.gov/pubmed/32007643 Die effektive Reproduktionzahl gibt an, wie viele Andere ein Infizierter ansteckt, nachdem Gegenmaßnahmen ergriffen wurden oder ein Teil der Population immun ist. Herdenimmunität ist erreicht, wenn so viele immun sind, dass jeder Infizierte weniger als eine Person ansteckt, die effektive Reproduktionszahl also unter 1 geht. Ist R0 = 2, müssen für Herdenimmunität mehr als 50% immun sein. Ist R0 = 3, müssen mehr als 66.6% immun sein. Pandemien wie Covid-19 sind erwartbar. Noch höher als für Coronaviren ist das Pandemierisiko für Grippeviren. Als Vorbereitung auf solche Szenarien erarbeitet die WHO Richtlinien zur Vorbereitung auf Grippepandemien https://www.who.int/influenza/preparedness/en/. In vielen Ländern gibt es dementsprechende nationale Influenza-Pandemiepläne. So auch in Deutschland (https://www.gmkonline.de/documents/pandemieplan_teil-i_1510042222_1585228735.pdf). In Abschnitten 4.2 und 4.3 wird beschrieben, wie man mit Eindämmungsversuchen anfängt und bei zu starker Verbreitung zu Schadensbegrenzung/Folgenminderung übergeht. Die Kriterien hierfür sind nicht festgelegt, sondern müssen während der Epidemie entschieden werden. Einige Maßnahmen können sowohl für Eindämmung als auch für Folgenminderung zum Einsatz kommen, z.B. Einschränkung von Veranstaltungen. Stellungnahme der Deutschen Gesellschaft für Epidemiologie mit Modellrechnungen für Szenarios verschiedener Verläufe der Covid-19 Epidemie in Deutschland. Damit die Zahl der Betten in Intensivstationen ausreicht, dürfte R nur knapp über 1 liegen. https://www.dgepi.de/assets/Stellungnahmen/Stellungnahme2020Corona_DGEpi-21032020-v2.pdf Drastische Maßnahmen zur Kontaktreduzierung wurden in China eingeführt, insbesondere in der am schwersten getroffenen Stadt Wuhan. Durch den Lockdown senkte sich die Reproduktionszahl in der dicht besiedelten Millionenstadt deutlich. Nach dieser Schätzung von über 5 auf 0.5-0.6. Mizumoto er al. 2020, preprint. https://www.medrxiv.org/content/10.1101/2020.02.12.20022434v2, obwohl andere Studien auch nach Lockdown noch Werte um 1 schätzen, z.B. Kucharski er al. 2020, Lancet Infect Dis, S1473-3099(20)30144-4. https://www.thelancet.com/journals/laninf/article/PIIS1473-3099(20)30144-4/fulltext Modellierungen des RKI, die mögliche Saisonalität und bereits bestehende Immunität berücksichtigen. Beides wäre gut für uns: flachere Kurven, weniger Erkrankte insgesamt, Eindämmung durch Kontaktverfolgung + Isolierung wäre einfacher. Aber auch mit starker Saisonalität und beträchtlicher bereits bestehenden Immunität würde die Zahl der gleichzeitigen Erkrankungen die Kapazität des Gesundheitssystems übersteigen, wenn sie nicht durch zusätzliche Maßnahmen gesenkt wird. https://www.rki.de/DE/Content/InfAZ/N/Neuartiges_Coronavirus/Modellierung_Deutschland.pdf?__blob=publicationFile Interaktives Modell für die Ausbreitung einer Epidemie, mit dem man selber verschiedene Parameter ausprobieren kann. Von Gabriel Goh. http://gabgoh.github.io/COVID/index.html","Mai Thi Nguyen-Kim,Nguyen-Kim,Mai Thi,Mai,maiLab,mai Lab,quarks,Terra X Lesch,Corona,Coronavirus,Coronakrise,virus,krise,covid-19,sars-cov-2,lockdown,Ausgangssperre,Kontaktsperre,Kontaktverbot,Versammlungsverbot,Flattenthecurve,flatten the curve,Kurve,flach,Masken,Infketion,Infizierungen,Maßnahmen,Dauer,dauer,wie lange,Komisch alles chemisch",28,"Science & Technology",PT22M26S,1346,2d,hd,true,https://i.ytimg.com/vi/3z0gnXgK8Do/maxresdefault.jpg,1,6692680,268439,,0,48174
33,UCyHDQ5C6z1NDmJ4g6SerW8g,maiLab,7X1Pok9VW1E,2019-12-26T08:00:02Z,"2019-12-26 08:00:02","Das war's.","Auf Wiedersehen, Freunde der Sonne","Mai Thi Nguyen-Kim,Mai Thi,Nguyen-Kim,Nguyen,Kim,Mai,mailab,lab,Quarks,Terra X,Terra X Lesch,The Secret Life Of Scientists,Komisch alles chemisch,Komisch,alles chemisch,Chemie,schwanger,Schwangerschaft,YouTube,Youtuber,Algorithmus,Pause,Glocke,Wissenschaft,Wissen",28,"Science & Technology",PT6M16S,376,2d,hd,true,https://i.ytimg.com/vi/7X1Pok9VW1E/maxresdefault.jpg,1,1698058,108053,,0,7857
34,UCyHDQ5C6z1NDmJ4g6SerW8g,maiLab,C6OR82i2hA4,2019-12-15T07:00:03Z,"2019-12-15 07:00:03","Die Erblichkeit von Homosexualität","Zeig mir deine Gene und ich sag dir wie homosexuell du bist - So das Versprechen der App ""How Gay Are You?"". Laut Anbieter bezieht sie sich auf eine große wissenschaftliche Studie zur Genetik von Homosexualität, die dieses Jahr veröffentlicht wurde, und kann dir angeblich verraten, wie schwul oder lesbisch seine Gene sind. Kann das sein? Kann man die Sexualität anhand der Gene ablesen? Und ist Homosexualität überhaupt genetische / erblich? Holt euch einen Tee, wir klären das. Featuring Kostas von Kostas Kind: https://www.youtube.com/user/KostaasKind SHOWNOTES (Weiterführende Infos & Quellen): https://docs.google.com/document/d/1eGltrMCm4abEEysLynAvuInQiWC_m-49R-eLDQHAnog/edit?usp=sharing ► maiLab abonnieren: https://bit.ly/2kru8qh ► Instagram @maithink: https://www.instagram.com/maithink ► Twitter @maithi_nk: https://www.twitter.com/maithi_nk maiLab wird produziert von Mai Thi Nguyen-Kim für funk (ARD & ZDF) ►funk Web-App: https://go.funk.net","Mai Thi Nguyen-Kim,Mai Thi,Nguyen-Kim,Mai,Nguyen,maiLab,Lab,Komisch alles chemisch,komisch,alles chemisch,The Secret Life Of Scientists,Quarks,Terra X,Terra X Lesch,Homosexualität,homosexuell,schwul,lesbisch,queer,gay,lgbtq,lgbt,lgbtq+,Gene,genetisch,erblich,Erblichkeit,vererbt,Umwelt,umweltbedingt,Erziehung,Life Style,Wissenschaft,Natur,natürlich,Wissen,Genetik,Polygenic Scores,DNA,Chromosomen",28,"Science & Technology",PT21M4S,1264,2d,hd,true,https://i.ytimg.com/vi/C6OR82i2hA4/maxresdefault.jpg,1,821338,40406,,0,5508
35,UCyHDQ5C6z1NDmJ4g6SerW8g,maiLab,mt-bI6tH5uU,2019-11-29T05:30:00Z,"2019-11-29 05:30:00","Superintelligent durch Brain Machine Interface","Künstliche Intelligenz, Superintelligenz, Cyborgs? Auch Elon Musk setzt nun auf Brain-Machine-Interfaces, Schnittstellen zwischen Gehirn und Maschine. Die Forschung hierzu ist weiter als die meisten wahrscheinlich vermuten! Hier ein Überblick über die faszinierende Technologie und das, was heute bereits möglich ist. ► maiLab abonnieren: http://bit.ly/2kru8qh ► Instagram @maithink: https://www.instagram.com/maithink ► Twitter @maithi_nk: https://www.twitter.com/maithi_nk maiLab wird produziert von Mai Thi Nguyen-Kim für funk (ARD & ZDF) ►funk Web-App: https://go.funk.net ►https://go.funk.net/impressum Autor: Dennis Eckmeier https://www.eckmeier.de Redaktion: Lars Dittrich Grafik: Melanie Gath Redaktionsleitung, Produktion & Schnitt: Mai Thi Nguyen-Kim Feat. Raul Krauthausen, Aktivist für Inklusion und Barrierefreiheit Homepage: https://www.raul.de Kostenloser, wöchentlicher Newsletter zum Thema Inklusion & Innovation für alle Interessierten: https://raul.us8.list-manage.com/subscribe?u=ff13c518142950e1da3755149&id=c96b003a32 QUELLEN Elon Musk & seine Firma Neuralink wollen Brain Machine Interfaces mit hoher Bandbreite entwickeln. Hier das besagte Preprint-Paper: Musk, E. (2019). An integrated brain-machine interface platform with thousands of channels. Journal of medical Internet research, 21(10), e16194. https://www.jmir.org/2019/10/e16194/ Neuralink Launch Event: https://youtu.be/r-vbh3t7WVI (Hieraus der Videoausschnitt) Forschungsbeispiel 1. Sinneserweiterung durch BMIs Hier die Studie mit den Ratten, die lernten, Infrarotlicht zu erfühlen: Thomson, E. E., Carra, R., & Nicolelis, M. A. (2013). Perceiving invisible light through a somatosensory cortical prosthesis. Nature communications, 4, 1482. https://www.nature.com/articles/ncomms2497 Entsprechender Ausschnitt aus einem Vortrag von Nicolelis (mit Video): https://youtu.be/ZENFjtLExmE?t=1482 aus Miguel Nicolelis - The Future of Human Augmentation - Nokia Bell Labs Forschungsbeispiel 2: Prothesensteuerung durch BMIs Hier die Studie mit dem Affen, der lernte, einen Roboterarm als “dritten Arm” zu benutzen: Carmena, J. M., Lebedev, M. A., Crist, R. E., O'Doherty, J. E., Santucci, D. M., Dimitrov, D. F., ... & Nicolelis, M. A. (2003). Learning to control a brain–machine interface for reaching and grasping by primates. PLoS biology, 1(2), e42. https://journals.plos.org/plosbiology/article?id=10.1371/journal.pbio.0000042 Entsprechender Ausschnitt aus einem Vortrag von Nicolelis (mit Video): https://youtu.be/ZENFjtLExmE?t=885 aus Miguel Nicolelis - The Future of Human Augmentation - Nokia Bell Labs Forschungsbeispiel 3: Gedankenübertragung durch BMIs Hier die Studie mit den zwei Ratten, die eine Art Gedankenübertragung via BMI erlernen konnten: Pais-Vieira, M., Lebedev, M., Kunicki, C., Wang, J., & Nicolelis, M. A. (2013). A brain-to-brain interface for real-time sharing of sensorimotor information. Scientific reports, 3, 1319. https://www.nature.com/articles/srep01319?links=false Jan Scheuermann und der BMI-gesteuerte Roboterarm: https://youtu.be/76lIQtE8oDY One Giant Bite: Woman with Quadriplegia Feeds Herself Chocolate Using Mind-Controlled Robot Arm - UPMC Steuerung eines Exoskeletts (28-jähriger querschnittgelähmter Franzose kann Exoskelett via semi-invasivem BMI bedienen): Benabid, A. L., Costecalde, T., Eliseyev, A., Charvet, G., Verney, A., Karakas, S., ... & Schaeffer, M. C. (2019). An exoskeleton controlled by an epidural wireless brain–machine interface in a tetraplegic patient: a proof-of-concept demonstration. The Lancet Neurology. http://www.clinatec.fr/wp-content/uploads/The-Lancet-Neurology_PUBLI-BCI.pdf Exoskeleton Controlled by a Brain-Machine Interface - The Lancet: https://youtu.be/1GyJBBB8O_M Weiterer Beitrag (Al Jazeera): https://youtu.be/vG_FLmQn8ug Bildquellen: Elon Musk Foto von Steve Jurvetson - https://www.flickr.com/photos/jurvetson/18659265152/, CC BY 2.0, https://commons.wikimedia.org/w/index.php?curid=40974345 SpaceX Foto von NASA/Tony Gray and Kevin O'Connell - http://mediaarchive.ksc.nasa.gov/detail.cfm?mediaid=49736, Gemeinfrei, https://commons.wikimedia.org/w/index.php?curid=12254087 Tesla Foto von Von Jeremy from Sydney, Australia - Tesla Model S at Dealership, CC BY 2.0, https://commons.wikimedia.org/w/index.php?curid=46871855 Transkranielle Gehirnstimulation: By Baburov - Own work, CC BY-SA 4.0, https://commons.wikimedia.org/w/index.php?curid=39754391","Mai Thi Nguyen-Kim,Mai Thi,Nguyen-Kim,Mai,lab,mailab,Quarks,Terra X,Terra X Lesch,The Secret Life Of Scientists,Komisch alles chemisch,komisch,alles chemisch,Brain Machine Interface,Brain Machein Interfaces,Brain-Machine-Interface,BMI,Schnittstelle,Künstliche Intelligenz,Intelligenz,Cyborg,Cyborgs,Tony Stark,Elon Musk,Neuralink,Gehirn,Hirn,Technologie,Elektrode,Elektroden,Maschine,Computer",28,"Science & Technology",PT17M57S,1077,2d,hd,true,https://i.ytimg.com/vi/mt-bI6tH5uU/maxresdefault.jpg,1,376544,16354,,0,2087
36,UCyHDQ5C6z1NDmJ4g6SerW8g,maiLab,rt5ZtBfDrIs,2019-11-18T05:30:02Z,"2019-11-18 05:30:02","Wie sinnvoll ist eine Grippeimpfung?","Wir befinden uns mitten in der Grippesaison, die noch bis etwa März anhalten wird.Sollte man sich gegen Grippe impfen lassen oder nicht?Gute Frage, denn die Grippeimpfung unterscheidet sich in einigen Punkten von “klassischen” Impfungen. Hier der wissenschaftliche Überblick.► maiLab abonnieren: http://bit.ly/2kru8qh ► Instagram @maithink: https://www.instagram.com/maithink ► Twitter @maithi_nk: https://www.twitter.com/maithi_nkmaiLab wird produziert von Mai Thi Nguyen-Kim für funk (ARD &amp; ZDF)►funk Web-App: https://go.funk.net ►https://go.funk.net/impressumQUELLEN &amp; WEITERE INFOS ZUM NACHLESENDie wichtigsten Fragen und Antworten über die Grippe (Influenza): https://www.rki.de/SharedDocs/FAQ/Influenza/FAQ_Liste.htmlDie wichtigsten Fragen und Antworten über die Impfung: https://www.rki.de/SharedDocs/FAQ/Impfen/Influenza/faq_ges.html?nn=2375548Hier findet ihr auch die Risikogruppen, also die Antwort auf die Frage “Für wen wird die Grippeimpfung ausdrücklich empfohlen?”Und auch die Frage “Warum wir die Grippeimpfung nicht für alle empfohlen?” wird hier beanwortet. Das Robert-Koch-Institut betont hier ausdrücklich, dass “nicht empfehlen” keinesfalls bedeutet “abraten”. Man kann sich impfen lassen, wenn man das Risiko eine Grippeinfektionn senken oder andere schützen möchte.Habt ihr alle empfohlenen Impfungen? Hier geht’s zum Impfkalender des Robert-Koch-Instituts: https://www.rki.de/DE/Content/Kommissionen/STIKO/Empfehlungen/Aktuelles/Impfkalender.pdf?__blob=publicationFileMehr Infos zur Grippe zum Nachschauen - eine ganze Quarkssendung zum Thema Grippe mit meinem Kollegen Ralph Caspers: https://www1.wdr.de/mediathek/video/sendungen/quarks-und-co/video-grippe---wie-wir-uns-schuetzen-koennen-100.htmlEbenfalls zum Nachschauen - Quarks-Beitrag: Warum die Schweinegrippe so gefährlich ist: https://www1.wdr.de/mediathek/video/sendungen/quarks-und-co/video-grippeviren-im-vergleich--warum-die-schweinegrippe-so-gefaehrlich-ist--100.htmlGute englischsprachige Übersicht: Antigenic drift vs. antigenic shift: https://www.cdc.gov/flu/about/viruses/change.htmTagesschau-Bericht über die Grippesaison 2017/18, die tödlichste Saison seit 30 Jahren:https://www.tagesschau.de/inland/grippe-129.htmlDas Nationale Referezzentrum für Influenza: https://www.rki.de/DE/Content/Infekt/NRZ/Influenza/influenza_node.htmlDie Weltgesundheitsorganisation WHO über die Grippe: https://www.who.int/influenza/en/Auch wenn eine Grippeimpfung leicht daneben ging und man sich trotzdem ansteckt, können die Symptome deutlich milder sein: https://bmcinfectdis.biomedcentral.com/articles/10.1186/1471-2334-14-231","Mai Thi Nguyen-Kim,Mai Thi,Mai,Nguyen-Kim,Nguyen,mailab,lab,Quarks,Terra X Lesch,Terra X,The Secret Life Of Scientists,Komisch alles chemisch,Komisch,alles chemisch,Grippe,Influenza,Erkältung,Grippesaison,Grippeimpfung,Impfung,impfen,Winter,krank,Krankheit,anstecken,Empfehlung,STIKO,Gesundheit,gesund,Wissenschaft,Wissen,Medizin,VIrus,Viren,Impfstoff",28,"Science & Technology",PT13M13S,793,2d,hd,true,https://i.ytimg.com/vi/rt5ZtBfDrIs/maxresdefault.jpg,1,508406,20373,,0,3263
37,UCyHDQ5C6z1NDmJ4g6SerW8g,maiLab,pkbm102QX6k,2019-11-10T07:00:02Z,"2019-11-10 07:00:02","Sollte ich mein Kind im Internet zeigen?","Sollte man seine Kinder bei Social Media zeigen oder nicht? Wie stark darf man in die Persönlichkeitsrechte des Kindes eingreifen und welche Folgen könnte das für das spätere Leben des Kindes haben? Seit Bibi und Julian verkündet haben, dass sie ihr Kind ab jetzt zeigen, wird “Sharenting” (sharing + parenting) wieder viel diskutiert. Ich habe für euch geschaut, ob es zu diesem Thema Expertenmeinungen oder sogar Forschung gibt.► maiLab abonnieren: http://bit.ly/2kru8qh ► Instagram @maithink: https://www.instagram.com/maithink ► Twitter @maithi_nk: https://www.twitter.com/maithi_nkmaiLab wird produziert von Mai Thi Nguyen-Kim für funk (ARD &amp; ZDF)►funk Web-App: https://go.funk.net ►https://go.funk.net/impressumQUELLENBibi &amp; Julian beschließen ihr Kind öffentlich zu zeigen: https://youtu.be/ndUAV0Qo8LY Viele Eltern nutzen Social Media für Support und Austausch: https://www.pewresearch.org/internet/2015/07/16/parents-and-social-media/Empfehlungen zweier Kinderärzte (7. Ratschläge)Keith, B. E., &amp; Steinberg, S. (2017). Parental sharing on the internet: Child privacy in the age of social media and the pediatrician’s role. JAMA pediatrics, 171(5), 413-414.https://jamanetwork.com/journals/jamapediatrics/article-abstract/2613405Private Posts und Stories können immer wieder mit recht einfachen Tricks doch von Fremden gesehen und runtergeladen werden: https://www.buzzfeednews.com/article/ryanhatesthis/private-instagram-posts-arent-exactly-privateAugenscheinlich unschuldige Fotos / Videos von Babies, Kindern und Jugendlichen können doch in pädophilen Datenbanken landen: https://www.mimikama.at/allgemein/harmlose-kinderfotos/https://www.mimikama.at/allgemein/kinderfotos-sammelbericht/https://www.smh.com.au/national/millions-of-social-media-photos-found-on-child-exploitation-sharing-sites-20150929-gjxe55.htmlKampagne #DeinKindAuchNicht https://deinkindauchnicht.org/Wie schlimm finden es Jugendliche im Nachhinein, dass ihre Eltern Kinder- und Babyfotos von ihnen geteilt haben?Ouvrein, G., &amp; Verswijvel, K. (2019). Sharenting: Parental adoration or public humiliation? A focus group study on adolescents' experiences with sharenting against the background of their own impression management. Children and Youth Services Review, 99, 319-327.https://www.sciencedirect.com/science/article/pii/S0190740918309952Greta Thunbergs erzählt, dass ihr Schwester gemobbt wird: https://www.welt.de/vermischtes/article201992666/Greta-Thunberg-Mobbing-Hass-und-Schikanen-gegen-Schwester.htmlMacht Social Media unglücklich? - Social Media beeinträchtigt das seelische Wohlbefinden, wenn die jugendlichen Nutzer Cybermobbing erfahren oder wenn positive Dinge wie Schlaf oder Sport auf der Strecke bleiben.Viner, R. M., Aswathikutty-Gireesh, A., Stiglic, N., Hudson, L. D., Goddings, A. L., Ward, J. L., &amp; Nicholls, D. E. (2019). Roles of cyberbullying, sleep, and physical activity in mediating the effects of social media use on mental health and wellbeing among young people in England: a secondary analysis of longitudinal data. The Lancet Child &amp; Adolescent Health, 3(10), 685-696.https://www.sciencedirect.com/science/article/abs/pii/S2352464219301865","Mai Thi Nguyen-Kim,Mai Thi,Nguyen-Kim,Nguyen,mailab,mai,Quarks,Terra X,Terra X Lesch,The Secret Life Of Scientists,Komisch alles chemisch,Komisch,alles chemisch,Kind,Kinder,Baby,Babys,Babies,Schwangerschaft,schwanger,Eltern,Social Media,Instagram,Facebook,teilen,Fotos,Videos,Influencer,Bibi,Julian,Bibiy Beauty Palace,Mutter,Internet,Momfluencer,sharenting,sharing,parenting,Wissen,Wissenschaft",27,Education,PT10M55S,655,2d,hd,true,https://i.ytimg.com/vi/pkbm102QX6k/maxresdefault.jpg,1,457450,19577,,0,2101
