position,channelId,channelTitle,videoId,publishedAt,publishedAtSQL,videoTitle,videoDescription,tags,videoCategoryId,videoCategoryLabel,duration,durationSec,dimension,definition,caption,thumbnail_maxres,licensedContent,viewCount,likeCount,dislikeCount,favoriteCount,commentCount
105,UCyHDQ5C6z1NDmJ4g6SerW8g,maiLab,P3C6N7b3ap8,2018-04-12T04:30:02Z,"2018-04-12 04:30:02","Bestimmt deine Herkunft deine Intelligenz?","Die Erblichkeit von Intelligenz ist ein heikles Thema. Vor allem, wenn es um die Intelligenzunterschiede zwischen Ländern oder Ethnien geht, findet man in der öffentlichen Diskussion kaum Sachlichkeit mehr. Dabei sind sich Genetiker und Psychologen hier eigentlich einig. Ich hab mir die verhaltensgenetischen Studien mal genau angeschaut und verrate euch, was in politischen Diskussionen immer wieder übersehen wird. SCIENCE! \o/ ----- QUELLEN Asendorpf, Jens B., and Franz J. Neyer. Psychologie der Persönlichkeit (6. Auflage). Springer-Verlag, 2018. (Kapitel 2.5 und 6.2) Spinath, F.M. & Klauer, K.J. (2018). Anlage und Umwelt. In D.H. Rost, J.R. Sparfeldt & S.R. Buch (Hrsg.), Handwörterbuch Pädagogische Psychologie (5. überarbeitete und erweiterte Auflage; S.1-7). Weinheim: PVU. Vielen Dank außerdem an Herrn Prof. Dr. Frank Spinath für das aufschlussreiche Hintergrundgespräch. ------ WEITERE INFOS Auch wenn man bisher (noch) nicht weiß, wie die Intelligenz mit dem chemischen Aufbau unseres Genoms zusammenhängt, so ist den Molekulargenetikern vor wenigen Jahren doch ein kleiner Durchbruch gelungen: Inzwischen kann man den Unterschied im Bildungserfolg (“Educational Attainment”, korreliert mit IQ) voraussagen - wenn man das gesamte Genom der Versuchsteilnehmer kennt. Zwar kann man bisher nur einen kleinen Prozentsatz voraussagen, erstaunlich ist es aber allemal, dass die Gesamtheit unseres Genoms da überhaupt Zusammenhänge aufweist, die über einen Zufall hinausgehen. Hier ein Übersichtsartikel: https://www.gwern.net/docs/iq/2018-plomin.pdf Die Adoptionsmethode ist vom Prinzip her ganz ähnlich zur Zwillingsmethode. Beide zusammen repräsentieren DIE klassischen Methoden der Verhaltensgenetik. (siehe ab Seite 6: http://www.fspsy.uni-freiburg.de/wp-content/uploads/2011/02/Asendorpf-Kap.-6.doc) Allerdings sind diese Methoden inzwischen auch schon etwas “veraltet”, bei allem, was heutzutage bekannt und erforscht ist (z.B. Genom-Umwelt-Korrelationen), arbeiten Wissenschaftler an optimierten Methoden, z.B. die TwinLife Studie: http://www.twin-life.de/de ------ ► schönschlau heißt jetzt maiLab! Hier abonnieren: http://bit.ly/2kru8qh ► Bei Facebook vorübergehend noch unter schönschlau: https://www.facebook.com/schoenschlau/ ► Facebook Mai Thi Nguyen-Kim: https://www.facebook.com/MaiThiNguyenKim ► Instagram: https://www.instagram.com/maithink ► Twitter: https://www.twitter.com/maithi_nk ►YouTube: https://www.youtube.com/funkofficial ►funk Web-App: https://go.funk.net ►Facebook: https://facebook.com/funk ►https://go.funk.net/impressum","Mai,Thi,Nguyen-Kim,Nguyen,Kim,mailab,lab,schönschlau,schön,schlau,The Secret Life Of Scientists,TerraX,Terra X,funk,Intelligenz,Genetik,genetisch,Gene,erblich,Erblichkeit,erben,Herkunft,Ethnie,Chancengleichheit,Wissenschaft,Politik,Psychologie,Wissen,IQ,Intelligenzquotient",28,"Science & Technology",PT19M18S,1158,2d,hd,true,https://i.ytimg.com/vi/P3C6N7b3ap8/maxresdefault.jpg,1,616636,22643,,0,4331
106,UCyHDQ5C6z1NDmJ4g6SerW8g,maiLab,TpnkdhvxbXs,2018-04-05T04:30:01Z,"2018-04-05 04:30:01","Das Ende von schönschlau","Tschüs schönschlau, hallo maiLab. Für alle etwas neueren Freunde der Sonne, hier alle kurz eingeblendeten Videos in voller Länge, sortiert von neu nach alt: “Fluoride verkalken das Gehirn!” | Nerd Analyse https://youtu.be/tAHWL3pgOp8 Die Klimawandel-Therapie https://youtu.be/IQfk95LvRTI DER SALZBERICHT | Wie ungesund ist Salz? https://youtu.be/_JSqBxDG6yA Alles ist Chemie (Stand By Me Cover) https://youtu.be/SqX8BSGCsyI Warum niemand Wissenschaftler werden will https://youtu.be/YL1Q2MObTMY Wie fühlt es sich an Tiere zu töten? #AskAScientist https://youtu.be/pZq02cIPt2c TIDE POD CHALLENGE - Die ganze Wahrheit https://youtu.be/vrdddeITKeI Wie Chemiker Weihnachten feiern | Teil 2 https://youtu.be/e2xkdmY7B0A Wie Chemiker Weihnachten feiern | Teil 1 https://youtu.be/opNrQXIBB8s Optische Täuschung verbessert Seekraft | SCIENCE NEWS https://youtu.be/sALMWSSFok0 TIERVERSUCHE | Mai reagiert auf Adam ruins everything https://youtu.be/xSjak-Ew6dA Molekularküche: Nuss-Nugat-Puder | MEGA-FAIL https://youtu.be/3WwyRCPoxtI XXL CHEMIE HAUL (Parodie) https://youtu.be/f5Cuux1X0l8 Wenn Asiaten Alkohol trinken | Mai betrinkt sich https://youtu.be/XTMIomsXxKM Was tun gegen Mückenstiche? https://youtu.be/T1BStwmxX4w Warum werden die Finger im Wasser schrumpelig? https://youtu.be/JEcfVWg5kMw Wie funktioniert Fett verbrennen? https://youtu.be/NwjcHZatCyI Chemie in der Weihnachtsbäckerei https://youtu.be/01ctwIC69LE Was passiert, wenn Astronauten rülpsen https://youtu.be/zR2VfdrLrPs ► maiLab abonnieren: http://bit.ly/2kru8qh ► Facebook Mai Thi Nguyen-Kim: https://www.facebook.com/MaiThiNguyenKim ► Instagram: https://www.instagram.com/maithink ► Twitter: https://www.twitter.com/maithi_nk WHAT THE FUNK? ►YouTube: https://www.youtube.com/funkofficial ►funk Web-App: https://go.funk.net ►Facebook: https://facebook.com/funk ►https://go.funk.net/impressum","Mai,Thi,Nguyen,Kim,Nguyen-Kim,schönschlau,maiLab,The Secret Life Of Scientists,TerraX,Terra X,funk,Wissen,Wissenschaft,Naturwisseschaft,Chemie",28,"Science & Technology",PT3M56S,236,2d,hd,true,https://i.ytimg.com/vi/TpnkdhvxbXs/maxresdefault.jpg,1,220117,11451,,0,1084
107,UCyHDQ5C6z1NDmJ4g6SerW8g,maiLab,tAHWL3pgOp8,2018-03-29T06:26:25Z,"2018-03-29 06:26:25","""Fluoride verkalken das Gehirn!"" | Fast Forward Science 2018","“Fluoride machen krank!” “Fluoride machen dumm!” “Fluoride verkalken die Zirbeldrüse!” … Jetzt aber mal wissenschaftlich. Follow-up zu “FLUORIDE & ZAHNPASTA - Die ganze Wahrheit”: https://youtu.be/yg3b8hcUDQs Freunde der Sonne! Mit diesem Video nehmen wir Teil am Fast Forward Science Wettbewerb 2018! Ein ziemlich cooler Contest für wissenschaftliche Webvideos: http://www.fastforwardscience.de Schaut gerne mal rein! ------------------------------- FOLLOW ME ► schönschlau abonnieren: http://bit.ly/2kru8qh ► Facebook schönschlau: https://www.facebook.com/schoenschlau/ ► Facebook Mai Thi Nguyen-Kim: https://www.facebook.com/MaiThiNguyenKim ► Instagram: https://www.instagram.com/maithink ► Twitter: https://www.twitter.com/maithi_nk WHAT THE FUNK? ►YouTube: https://www.youtube.com/funkofficial ►funk Web-App: https://go.funk.net ►Facebook: https://facebook.com/funk ►https://go.funk.net/impressum -------------------------------- QUELLEN #1 Die ELEMENT-Studie: Bashash, Morteza, et al. ""Prenatal fluoride exposure and cognitive outcomes in children at 4 and 6–12 years of age in Mexico."" Environ Health Perspect 125.9 (2017): 097017. - https://bit.ly/2utQU7h Mehr Infos zu ELEMENT in diesem YouTube-Video von der University of Michigan: https://youtu.be/_D2SzX1k_KM und der Homepage: https://sph.umich.edu/cehc/research/element.html --- #2 Die chinesische Meta-Analyse Tang, Qin-qing, et al. ""Fluoride and children’s intelligence: a meta-analysis."" Biological trace element research 126.1-3 (2008): 115-120. - https://bit.ly/2GhJ025 Die neuere, optimierte Meta-Analyse: Choi, Anna L., et al. ""Developmental fluoride neurotoxicity: a systematic review and meta-analysis."" Environmental health perspectives 120.10 (2012): 1362. - https://bit.ly/2GR9xV2 Tierstudien, in welchen Tieren höhere Fluoridkonzentrationen systemisch verabreicht wurden, stellen Giftigkeit fest, Beispiele: Everett, E. T. ""Fluoride’s effects on the formation of teeth and bones, and the influence of genetics."" Journal of dental research 90.5 (2011): 552-560. - https://bit.ly/2GmZhmI Varner, Julie A., et al. ""Chronic administration of aluminum–fluoride or sodium–fluoride to rats in drinking water: alterations in neuronal and cerebrovascular integrity."" Brain research784.1-2 (1998): 284-298. - https://bit.ly/2GUEpny --- #3 Lukes Zirbeldrüsenstudie Luke, Jennifer. ""Fluoride deposition in the aged human pineal gland."" Caries Research 35.2 (2001): 125-128. - https://bit.ly/2IcdEuk Review-Artikel zur Zirbeldrüse & Calcification Tan, Dun Xian, et al. ""Pineal Calcification, Melatonin Production, Aging, Associated Health Consequences and Rejuvenation of the Pineal Gland."" Molecules 23.2 (2018): 301. - https://bit.ly/2IcyfyV --- Die European Food Safety Authority (EFSA) über Fluoride (inkl. offizieller Empfehlung: 0,05 mg / kg Körpergewicht Fluorid pro Tag - https://bit.ly/2pN3BoV) --- BILDQUELLEN Zirbeldrüse: Von Geo-Science-International - Eigenes Werk, CC BY-SA 4.0, https://commons.wikimedia.org/w/index.php?curid=47016028","Mai,Thi,Nguyen,Kim,Nguyen-Kim,maiLab,schönschlau,The Secret Life Of Scientists,Fluoride,Zahnpasta,Zähne,putzen,Karies,sicher,gesund,Gesundheit,krank,Krankheit,Gift,giftig,toxisch,gefährlich,Wissenschaft,wissenschaftlich,Medizin,Chemie,Biologie,Gehirn,Hirn,Zirbeldrüse,dumm,Dummheit,Verschwörung,Lüge,Kalk,verkalken,verkalkt,Drittes,Auge,Melatonin,funk,mai Lab,Lab,TerraX,Terra X,Fast Forward Science,Webvideo,Wettbewerb,Science,Wissenschaft im Dialog",28,"Science & Technology",PT15M18S,918,2d,hd,true,https://i.ytimg.com/vi/tAHWL3pgOp8/maxresdefault.jpg,1,527482,36296,,0,8135
108,UCyHDQ5C6z1NDmJ4g6SerW8g,maiLab,IQfk95LvRTI,2018-03-22T05:30:00Z,"2018-03-22 05:30:00","Die Klimawandel-Therapie","Beim Klimawandel reichen manchmal die Fakten alleine nicht aus. Da hilft nur der richtige emotionale Trigger. WEITERE INFOS Der Klimareport (ARD-Reportage): http://www.daserste.de/information/reportage-dokumentation/dokus/videos/der-klimareport-video-102.html Steigende Temperaturen bedrohen die Existenz der Meeresschildkröten, denn werden die Strände zu heiß, schlüpfen nicht genug Männchen: http://bit.ly/2GGkoRV Der Klimawandel bedroht Bambuspflanzen und damit auch Pandabären. Artikel http://bit.ly/2CdhIrY und die dazu gehörige Studie: http://bit.ly/2FSVoWi Pfeifhasen geht der Lebensraum aus: Artikel: http://bit.ly/2fT5x7I und Video: http://bit.ly/2DCOylM Und last but not least, das beste Video im Internet - der Pika-Ruf: https://youtu.be/W4U9IxhQSTc ------ ► schönschlau abonnieren: http://bit.ly/2kru8qh ► Facebook schönschlau: https://www.facebook.com/schoenschlau/ ► Facebook Mai Thi Nguyen-Kim: https://www.facebook.com/MaiThiNguyenKim ► Instagram: https://www.instagram.com/maithink ► Twitter: https://www.twitter.com/maithi_nk WHAT THE FUNK? ►YouTube: https://www.youtube.com/funkofficial ►funk Web-App: https://go.funk.net ►Facebook: https://facebook.com/funk ►https://go.funk.net/impressum","Mai,Thi,Nguyen,Kim,Nguyen-Kim,schönschlau,The Secret Life Of Scientists,Klimawandel,Erderwärmung,Schildkröten,Meeresschildkröten,Eisbär,Eisbären,Panda,Pandas,Pandabär,Pandabären,Pika,Pikas,Pfeifhase,Pfeifhasen,Natur,Umwelt,Umweltschutz,Wissenschaft,Naturwissenschaft,Forschung,Klima,Erwärmung,Climate Change,funk,maiLab,mai Lab,Lab,TerraX,Terra X",28,"Science & Technology",PT3M15S,195,2d,hd,true,https://i.ytimg.com/vi/IQfk95LvRTI/maxresdefault.jpg,1,104445,6651,,0,681
109,UCyHDQ5C6z1NDmJ4g6SerW8g,maiLab,_JSqBxDG6yA,2018-03-15T05:30:25Z,"2018-03-15 05:30:25","DER SALZBERICHT | Wie ungesund ist Salz?","Salz ist GIFT! :D Nee, Spaß, erstmal genug GIFT! Videos (danke für die tolle Resonanz!), aber dass zu viel Salz ungesund ist, hat doch jeder schon mal gehört. Was genau passiert im Körper, wenn man zu viel Salz ist? Kann man sich vielleicht wirklich mit Salz vergiften? Wieviel sollte man essen? Und schaffst man das überhaupt? Alle Antworten hier! ------- FOLLOW ME ► schönschlau abonnieren: http://bit.ly/2kru8qh ► Facebook schönschlau: https://www.facebook.com/schoenschlau/ ► Facebook Mai Thi Nguyen-Kim: https://www.facebook.com/MaiThiNguyenKim ► Instagram: https://www.instagram.com/maithink ► Twitter: https://www.twitter.com/maithi_nk ------ QUELLEN & WEITERE INFOS Iodsalz - FAQ vom Bundesinstitut für Risikobewertung http://www.bfr.bund.de/de/fragen_und_antworten_zur_jodversorgung_und_zur_jodmangelvorsorge-128626.html musstewissen Basics zu Natrium & Co.: https://youtu.be/NpgVk9leUbs Guter Übersichtsartikel zu Natrium, seiner Rolle im Körper und den Gefahren von zu viel Salz: https://www.wissenschaft-im-dialog.de/projekte/wieso/artikel/beitrag/wieso-ist-zu-viel-salz-schaedlich-fuer-den-koerper/ Review-Artikel: Eine Reduzierung des Salzkonsums kann die Gefahren für Herzkreislauferkrankungen senken. https://www.nature.com/articles/jhh2008144 http://www.bmj.com/content/346/bmj.f1326 Allerdings sind sich Wissenschaftler nicht unbedingt einig darüber, ob eine Salzreduzierung bei gesunden Menschen mit normalem oder tiefem Blutdruck überhaupt notwendig ist. Hier ein interessanter Artikel, der Entwarnung gibt und auf Unklarheiten in der aktuell bekannten Korrelation hinweist: https://www.scientificamerican.com/article/its-time-to-end-the-war-on-salt/ Die tödliche Dosis (LD50) von NaCl haben wir seinem MSDS Datenblatt entnommen: http://www.sciencelab.com/msds.php?msdsId=9927593 Der Salz-Pudding-Fall (eingeblendete Headlines): https://www.stern.de/panorama/stern-crime/prozess-fatale-salzpudding-vergiftung-3497450.html Die Deutsche Gesellschaft für Ernährung empfiehlt nicht mehr als 6 g Salz pro Tag zu sich zu nehmen: https://www.bmel.de/DE/Ernaehrung/GesundeErnaehrung/_Texte/DEGS_Salzstudie.html Bericht der Verbraucherzentrale über Salzgehalt in Brot: https://www.verbraucherzentrale.de/sites/default/files/migration_files/media221175A.pdf --- WHAT THE FUNK? ►YouTube: https://www.youtube.com/funkofficial ►funk Web-App: https://go.funk.net ►Facebook: https://facebook.com/funk ►https://go.funk.net/impressum","Mai,Thi,Nguyen,Kim,Nguyen-Kim,schönschlau,The Secret Life Of Scientists,Salz,salzig,gesund,ungesund,Gesundheit,giftig,Gift,Essen,Ernährung,Blutdruck,Bluthochdruck,Herz,Kreislauf,Funk,maiLab,mai Lab,Lab,TerraX,Terra X",28,"Science & Technology",PT9M15S,555,2d,hd,false,https://i.ytimg.com/vi/_JSqBxDG6yA/maxresdefault.jpg,1,888916,28693,,0,2582
110,UCyHDQ5C6z1NDmJ4g6SerW8g,maiLab,0vCAIpdMVsY,2018-03-08T05:30:01Z,"2018-03-08 05:30:01","Milch ist GIFT! wissenschaftlich geprüft","Falls ihr die letzten Tage nicht im Internet wart, hier die 2 Videos von Unge: Milch ist GIFT! - Kanada streicht Milch aus Ernährungspyramide: https://youtu.be/j7Bf18pGjAE Warum Milch GIFT ist - #milchistgift: https://youtu.be/2-1laUusmSQ ---- QUELLEN Zusammensetzung von Milch https://www.lbs.co.il/data/attachment-files/2015/08/26529_milk.pdf Milch & Hormone https://www.ncbi.nlm.nih.gov/pmc/articles/PMC4524299/ Die Geschichte der Laktoseintoleranz https://www.nature.com/news/archaeology-the-milk-revolution-1.13471 Turbokühe http://www.deutschlandfunkkultur.de/auch-turbokuehe-machen-muehe.993.de.html?dram:article_id=154479 Milch & Knochen https://academic.oup.com/ajcn/article/76/3/675/4677454 http://pediatrics.aappublications.org/content/117/2/578.short Milch & Osteoporose http://www.bmj.com/content/bmj/349/bmj.g6015.full.pdf http://onlinelibrary.wiley.com/doi/10.1002/jbmr.279/epdf https://academic.oup.com/ajcn/article/77/2/504/4689714 Milch & Prostatakrebs https://www.researchgate.net/profile/Alicja_Wolk/publication/226227777_Dairy_products_calcium_phosphorous_vitamin_D_and_risk_of_prostate_cancer_Sweden/links/02e7e53a35c809d33b000000/Dairy-products-calcium-phosphorous-vitamin-D-and-risk-of-prostate-cancer-Sweden.pdf https://academic.oup.com/ajcn/article/74/4/549/4737495?wptouch_preview_theme=enabled https://academic.oup.com/jnci/article/97/23/1768/2521503 Milch & Darmkrebs https://www.sciencedirect.com/science/article/pii/S0140673685910827#! https://academic.oup.com/jnci/article/93/17/1330/2519487 http://cebp.aacrjournals.org/content/cebp/7/2/163.full.pdf http://d.mp3vhs.de/C1/Grassrootshealth/6.pdf Milch & Diabetes http://www.onlinecjc.ca/article/S0828-282X(16)00005-2/fulltext Milch & Allgemeine Gesundheit http://www.mdpi.com/2072-6643/7/9/5363/htm Milch & Akne https://www.ncbi.nlm.nih.gov/pmc/articles/PMC4391699/ https://escholarship.org/uc/item/77b9s0z8 Bildquellen Bild Holstein-Kuh: Von Verum - Eigenes Werk, CC BY-SA 3.0, https://commons.wikimedia.org/w/index.php?curid=50467058 Akne Bild https://commons.wikimedia.org/w/index.php?curid=64459 --- CONFIRMATION BIAS Warum wir auf Fake News reinfallen | schönschlau https://youtu.be/TpD-tH9_DCw (Wissenschaftliche Quellen in der Videobeschreibung) Trust me I’m a scientist | The Secret Life Of Scientists https://youtu.be/SLJ_VzPsavA?t=2m30s --- WHAT THE FUNK? ► schönschlau abonnieren: http://bit.ly/2kru8qh ► Facebook schönschlau: https://www.facebook.com/schoenschlau/ ► Facebook Mai Thi Nguyen-Kim: https://www.facebook.com/MaiThiNguyenKim ► Instagram: https://www.instagram.com/maithink ► Twitter: https://www.twitter.com/maithi_nk ►YouTube: https://www.youtube.com/funkofficial ►funk Web-App: https://go.funk.net ►Facebook: https://facebook.com/funk ►https://go.funk.net/impressum","Mai,Thi,Nguyen,Kim,Nguyen-Kim,schönschlau,The Secret Life Of Scientists,unge,Milch,Gift,Gesundheit,Ernährung,Wissen,Wissenschaft,Forschung,Zeit,für,Fakten,Gefahren,Bedenken,vegan,Veganismus,Vegetarier,Chemie,Biologie,Medizin,Landwirtschaft,maiLab,Mai Lab,Lab,TerraX,Terra X",28,"Science & Technology",PT11M47S,707,2d,hd,true,https://i.ytimg.com/vi/0vCAIpdMVsY/maxresdefault.jpg,1,1610177,48946,,0,6521
111,UCyHDQ5C6z1NDmJ4g6SerW8g,maiLab,SqX8BSGCsyI,2018-03-01T05:30:00Z,"2018-03-01 05:30:00","Alles ist Chemie (Stand By Me Cover)","Inspiriert hiervon, gesehen im Deutschen Museum: https://www.instagram.com/p/BfbMUFWFwDj/ Wenn du gerne kochst, frisches Essen magst, doch am liebsten ohne Chemie - ist das schlecht formuliert, oh so schlecht formuliert, denn “chemiefrei”, Honey, das ist Essen nie Denn Darling alles ist Chemie Alles ist Chemie Oh alles ist Chemie Chiaseeds, reines Kokosöl und Naturseife, alles chemische Verbindungen, weißt du nicht? Ja ich weiß, was du meinst, wenn du sagst, du hasst Chemie Aber ohne, ohne sie gäb’s dich nicht Denn Darling alles ist Chemie Alles ist Chemie Oh alles ist Chemie WHAT THE FUNK? ► schönschlau abonnieren: http://bit.ly/2kru8qh ► Facebook schönschlau: https://www.facebook.com/schoenschlau/ ► Facebook Mai Thi Nguyen-Kim: https://www.facebook.com/MaiThiNguyenKim ► Instagram: https://www.instagram.com/maithink ► Twitter: https://www.twitter.com/maithi_nk ►YouTube: https://www.youtube.com/funkofficial ►funk Web-App: https://go.funk.net ►Facebook: https://facebook.com/funk ►https://go.funk.net/impressum","Mai,Thi,Nguyen,Kim,Nguyen-Kim,schönschlau,The Secret Life Of Scientists,Lied,Song,Chemie,Parodie,Satire,Humor,Chemikalien,Bio,Biologie,Natur,natürlich,Essen,Ernährung,Funk,MaiLab,mai Lab,Lab,chemistry,TerraX,Terra X",24,Entertainment,PT2M41S,161,2d,hd,true,https://i.ytimg.com/vi/SqX8BSGCsyI/maxresdefault.jpg,1,119832,7653,,0,595
112,UCyHDQ5C6z1NDmJ4g6SerW8g,maiLab,zTLflri1TRM,2018-02-22T05:30:01Z,"2018-02-22 05:30:01","Sollten dumme Menschen sterben?","4 Gründe, warum die Darwin-Awards wissenschaftlicher Bullshit sind oder Die häufigsten Irrtümer über Darwinismus, Evolution und Natürliche Selektion. --- ERWÄHNTE VIDEOS schönschlau - “TIDE POD CHALLENGE - Die ganze Wahrheit https://youtu.be/vrdddeITKeI LeFloid - “Ja bringt euch doch alle um... (Tide Pod Challenge? ICH FASS ES NICHT!)” https://youtu.be/uGGCBn0zzVs TEDx Talks - “TEDxSF - Wendy Northcutt -Darwin Awards” https://youtu.be/PixJ_y_ilmI National Geographic - “Bizarre, Furry Kiwi Bird Gets a Closer Look” https://www.youtube.com/watch?v=NPc25pbM95c schönschlau - “Wir sind schlauer als unsere Eltern | Der Flynn-Effekt” https://youtu.be/qrlxqSlCsas --- WEITERE INFOS Darwin Awards: http://www.darwinawards.com/ Intelligenz und Genetik: http://www.spektrum.de/magazin/iq-gene-welche-erbanlagen-praegen-unsere-intelligenz/1321865 http://www.spektrum.de/kolumne/der-geist-steckt-nicht-im-gen/1460133 Department of Conservation, New Zealand: http://www.doc.govt.nz/nature/native-animals/birds/birds-a-z/kiwi/ --- BILDQUELLEN Adler: By Juan lacruz - Own work, CC BY-SA 3.0, https://commons.wikimedia.org/w/index.php?curid=24364100 Kakadu: By www.viajar24h.com - Birds www.photo.org.es-3, CC BY 2.0, https://commons.wikimedia.org/w/index.php?curid=5529431 Krähen: By Neil McIntosh from Cambridge, United Kingdom - African Pied CrowsUploaded by snowmanradio, CC BY 2.0, https://commons.wikimedia.org/w/index.php?curid=18248938 Pinguine: By Hannes Grobe/AWI - Own work, CC BY 3.0, https://commons.wikimedia.org/w/index.php?curid=8845203 ------- WHAT THE FUNK? ► schönschlau abonnieren: http://bit.ly/2kru8qh ► Facebook schönschlau: https://www.facebook.com/schoenschlau/ ► Facebook Mai Thi Nguyen-Kim: https://www.facebook.com/MaiThiNguyenKim ► Instagram: https://www.instagram.com/maithink ► Twitter: https://www.twitter.com/maithi_nk ►YouTube: https://www.youtube.com/funkofficial ►funk Web-App: https://go.funk.net ►Facebook: https://facebook.com/funk ►https://go.funk.net/impressum","Mai,Thi,Nguyen,Kim,Nguyen-Kim,schönschlau,The Secret Life Of Scientists,Darwin,Awards,Darwinismus,Evolution,Tide,Pod,Challenge,Tidepod,Tidepods,dumm,Dummheit,Biologie,Wissen,Wissenschaft,Ethik,Moral,Natürliche,Selektion,Survival,Fittest,Le Floid,mailab,mai lab,lab,TerraX,Terra X",28,"Science & Technology",PT10M25S,625,2d,hd,true,https://i.ytimg.com/vi/zTLflri1TRM/maxresdefault.jpg,1,565960,24556,,0,2943
113,UCyHDQ5C6z1NDmJ4g6SerW8g,maiLab,YL1Q2MObTMY,2018-02-15T05:30:00Z,"2018-02-15 05:30:00","Warum niemand Wissenschaftler werden will","Mai Thi Nguyen-Kim ist Chemikerin und forscht an farbigen Flüssigkeiten, Edding auf Glasscheiben und Explosionen. Hier spricht sie sich erstmals öffentlich gegen die klischeehafte Darstellung von Wissenschaftlern aus. ------- ► schönschlau abonnieren: http://bit.ly/2kru8qh ► Facebook schönschlau: https://www.facebook.com/schoenschlau/ ► Facebook Mai Thi Nguyen-Kim: https://www.facebook.com/MaiThiNguyenKim ► Instagram: https://www.instagram.com/maithink ► Twitter: https://www.twitter.com/maithi_nk ►YouTube: https://www.youtube.com/funkofficial ►funk Web-App: https://go.funk.net ►Facebook: https://facebook.com/funk ►https://go.funk.net/impressum","Mai,Thi,Nguyen,Kim,Nguyen-Kim,schönschlau,The Secret Life Of Scientists,Wissenschaftler,Wissenschaftlerin,Wissenschaftlerinnen,Verrückt,Verrückter Wissenschaftler,Chemiker,Chemikerin,Chemie,Wissenschaft,Forschung,Klischee,Klischees,Vorurteile,Humor,Satire,mailab,mai lab,lab,TerraX,Terra X",22,"People & Blogs",PT2M23S,143,2d,hd,true,https://i.ytimg.com/vi/YL1Q2MObTMY/maxresdefault.jpg,1,106273,5642,,0,343
114,UCyHDQ5C6z1NDmJ4g6SerW8g,maiLab,yg3b8hcUDQs,2018-02-08T05:30:03Z,"2018-02-08 05:30:03","FLUORIDE & ZAHNPASTA - Die ganze Wahrheit","Was ist jetzt eigentlich mit diesen Fluoriden in der Zahnpasta?? QUELLEN Meyer-Lückel, Hendrik, Sebastian Paris, and Kim Ekstrand, eds. Karies: Wissenschaft und Klinische Praxis. Georg Thieme Verlag, 2012. Kapitel 2, S. 23-38, Ätiologie und Pathogenese der Karies Kapitel 12, S. 195-210, Karieskontrolle durch Beeinflussung der De- und Remineralisierung http://bit.ly/2sgB8vm Die sogenannte Verordnung (EG) Nr. 1223/2009 über kosmetische Mittel (http://bit.ly/2nR9AHn) gilt seit 11. Juli 2013 in der EU und ersetzte damit die sogenannte Richtlinie 76/768/EWG über kosmetische Mittel (http://bit.ly/2E7jXBO). Es gab im Zuge dessen durchaus Neuerungen und Ergänzungen, also Abgrenzungen gegenüber der alten Richtlinie (http://bit.ly/2E7kbZG), darunter waren allerdings keine neuen Grenzwerte für Fluoride in Zahnpasten - hier gab es seit 1978 keine neuen Festlegungen. Amaechi, B. T., & van Loveren, C. (2013). Fluorides and non-fluoride remineralization systems. In Toothpastes (Vol. 23, pp. 15-26). Karger Publishers. https://www.karger.com/Article/Abstract/350458 KANI, Tokuko, et al. ""Effect to apatite-containing dentifrices on dental caries in school children."" Journal of Dental Health 39.1 (1989): 104-109. https://www.jstage.jst.go.jp/article/jdh1952/39/1/39_1_104/_pdf Nur Verschwörungstheorie? So gefährlich ist Fluorid | Galileo | ProSieben https://youtu.be/YVVOQUGTf4A Kariesbild By Suyash.dwivedi (Own work) [CC BY-SA 4.0 (https://creativecommons.org/licenses/by-sa/4.0)], via Wikimedia Commons Thumbnail imago/westend61 ------- ► schönschlau abonnieren: http://bit.ly/2kru8qh ► Facebook schönschlau: https://www.facebook.com/schoenschlau/ ► Facebook Mai Thi Nguyen-Kim: https://www.facebook.com/MaiThiNguyenKim ► Instagram: https://www.instagram.com/maithink ► Twitter: https://www.twitter.com/maithi_nk ►YouTube: https://www.youtube.com/funkofficial ►funk Web-App: https://go.funk.net ►Facebook: https://facebook.com/funk ►https://go.funk.net/impressum","Mai,Thi,Nguyen,Kim,Nguyen-Kim,schönschlau,The Secret Life Of Scientists,Fluoride,Zahnpasta,Zähne,Zahnpflege,Gesundheit,gesund,giftig,Gift,Gehirn,Zirbeldrüse,Karies,Demineralisierung,Remineralisierung,Fluorapatit,Apatit,Hydroxylapatit,Karex,Werbung,Wissenschaft,Wissen,Chemie,zähne putzen,zähneputzen,mailab,mai lab,lab,TerraX,Terra X",28,"Science & Technology",PT8M38S,518,2d,hd,true,https://i.ytimg.com/vi/yg3b8hcUDQs/maxresdefault.jpg,1,695668,25147,,0,3409
