position,channelId,channelTitle,videoId,publishedAt,publishedAtSQL,videoTitle,videoDescription,tags,videoCategoryId,videoCategoryLabel,duration,durationSec,dimension,definition,caption,thumbnail_maxres,licensedContent,viewCount,likeCount,dislikeCount,favoriteCount,commentCount
64,UCyHDQ5C6z1NDmJ4g6SerW8g,maiLab,f8BSchIv7a0,2019-03-15T05:30:00Z,"2019-03-15 05:30:00","Wie schlimm sind Mikrowellen?","Ist es gesund, sein Essen in der Mikrowelle zu erhitzen? Was ist dran an Behauptunge wie “Mikrowellen verstrahlen das Essen” oder “Mikrowellen zerstören wertvolle Nährstoffe”? Wir gehen wie immer der Sache auf den Grund! ► maiLab abonnieren: http://bit.ly/2kru8qh ► Instagram: https://www.instagram.com/maithink ► Twitter: https://www.twitter.com/maithi_nk ►YouTube: https://www.youtube.com/funkofficial ►funk Web-App: https://go.funk.net ►Facebook: https://facebook.com/funk ►https://go.funk.net/impressum VIDEOS “So habt ihr Farben noch nie gesehen” (maiLab): https://youtu.be/r0jXfwPQW9k “Microwave Aluminum Foil” (RUPhys2012): https://www.youtube.com/watch?v=lhpndQJkNk0 “Standes Waves Part I: Demonstration” (James Dann): https://youtu.be/-gr7KmTOrx0 “Gehen Vitamine beim Kochen kaputt?” (maiLab / schönschlau): https://youtu.be/ikhlr8P50IU QUELLEN & HINWEISE Wie Mikrowellen funktionieren - Vollmer, 2004, Physics Education 39 (1):74-81: http://www.sfu.ca/phys/346/121/resources/physics_of_microwave_ovens.pdf Hieraus auch das Bild der stehenden Wellen innerhalb des Mikrowellenherds. Bundesamt für Strahlenschutz über elektromagnetische Strahlung allgemein: http://www.bfs.de/DE/themen/emf/emf_node.html Review-Artikel über Mikrowellen & ungleichmäßige Erhitzung, v.a. im Bezug auf Bakterien und Keime: https://link.springer.com/article/10.1007/s11947-008-0136-0 Ein paar Beispiele für Studien, in denen der Einfluss von Mikrowellenerhitzung auf die Lebensmittelqualität untersucht wurde: TURKMEN, N., SARI, F., & VELIOGLU, Y. (2005). The effect of cooking methods on total phenolics and antioxidant activity of selected green vegetables. Food Chemistry, 93(4), 713–718. https://fs.unb.br/nutricao/laboratorios/tecdie/wp-content/uploads/2012/10/The-effect-of-cooking-methods-on-total-phenolics-and-antioxidant-activity-of-selected-green-vegetables.pdf Zusammenfassung: Verschiedenes Gemüse reagiert verschieden auf Erhitzen/Kochen (Verlust von Antioxidantien) - doch die Art und Weise des Kochens spielte keine Rolle. Ruiz-Ojeda, L. M., & Peñas, F. J. (2013). Comparison study of conventional hot-water and microwave blanching on quality of green beans. Innovative Food Science & Emerging Technologies, 20, 191–197. https://www.sciencedirect.com/science/article/pii/S1466856413001471 Zusammenfassung: Blanchieren vs. Mikrowelle bei grünen Bohnen. Kein Unterschied zwischen beiden Kochweisen. Da Mikrowellen meist schnell geht, kann es sogar von Vorteil sein, weil z.B. weniger Vitamin C kaputtgeht. Zia-ur-Rehman, Z., Islam, M., & Shah, W. . (2003). Effect of microwave and conventional cooking on insoluble dietary fibre components of vegetables. Food Chemistry, 80(2), 237–240. https://www.sciencedirect.com/science/article/pii/S0308814602002595 Zusammenfassung: Vergleich zwischen Mikrowelle und normalem Kochen in Bezug auf Zersetzung schwer verdaulicher Cellulosefasern. Kochen ist hier besser als Mikrowelle, insbesondere pressure cooking. Und last but not least die Grüntee-Studie: Vuong, Q. V., Tan, S. P., Stathopoulos, C. E., & Roach, P. D. (2012). Improved extraction of green tea components from teabags using the microwave oven. Journal of Food Composition and Analysis, 27(1), 95-101. https://bit.ly/2F74orp","Mai,maiLab,Lab,Mai Ti,Schönschlau,Schön schlau,Wissen,Wissenschaft,Wissenschaftlerin,Chemikerin,Chemie,Technik,Physik,Doktor,Promotion,Unnützes Wissen,Wissensyoutuber,Youtuber,funk,ard,zdf,swr",28,"Science & Technology",PT10M56S,656,2d,hd,true,https://i.ytimg.com/vi/f8BSchIv7a0/maxresdefault.jpg,1,1016996,41578,,0,4713
65,UCyHDQ5C6z1NDmJ4g6SerW8g,maiLab,NLQdFeZMSbQ,2019-03-07T05:30:00Z,"2019-03-07 05:30:00","Zwischen Rassismus und Neugier: Woher kommst du?","Ist die Frage “Woher kommst du?” an einen Menschen mit Migrationshintergrund harmlose Neugier oder unsensible Ausgrenzung? Es wird unter #vonhier hitzig debattiert - doch es gibt ein paar Punkte, auf die wir uns alle einigen können. Quellen / Referenzen: Melissa aus Herne bei “Das Supertalent”: https://youtu.be/WD0sp0YcsH4 Malcolm Ohanwe über Dieter Bohlen: https://twitter.com/malcolmmusic/status/1097438488696406017?lang=de “Wo kommst du her? - Der ethnische Ordnungsfimmel” von Ferda Ataman: http://www.spiegel.de/kultur/gesellschaft/herkunft-und-die-frage-wo-kommst-du-her-ethnischer-ordnungsfimmel-a-1254602.html “Keine Antwort schuldig” von Vanessa Vu: https://www.zeit.de/campus/2019-02/herkunft-identitaet-diskriminierung-rassismus-selbstbestimmung Sebastian Vettel Bild: Von Morio - Eigenes Werk, CC BY-SA 4.0, https://commons.wikimedia.org/w/index.php?curid=63879288 ► maiLab abonnieren: http://bit.ly/2kru8qh ► Instagram: https://www.instagram.com/maithink ► Twitter: https://www.twitter.com/maithi_nk ►YouTube: https://www.youtube.com/funkofficial ►funk Web-App: https://go.funk.net ►Facebook: https://facebook.com/funk ►https://go.funk.net/impressum","Mai Thi Nguyen-Kim,Mai,Thi,Nguyen,Kim,Nguyen-Kim,maiLab,Lab,TerraX,Terra X,Lesch,Quarks,The Secret Life Of Scientists,Woher kommst du,vonhier,#vonhier,Rassismus,Alltagsrassismus,Ausgrenzung,Migrationshintergrund,Ausländer,deutsch,Deutsche,Deutschland,Neugier,Fragen,Frage,Wurzeln,Debatte,Diskussion,Dieter Bohlen,Supertalent,Melissa,Malcolm Ohanwe,Ferda Ataman,Twitter,Spiegel,Vanessa Vu,Zeit",22,"People & Blogs",PT11M25S,685,2d,hd,true,https://i.ytimg.com/vi/NLQdFeZMSbQ/maxresdefault.jpg,1,1056947,52789,,0,9931
66,UCyHDQ5C6z1NDmJ4g6SerW8g,maiLab,cjUDp3-4s14,2019-02-28T05:30:02Z,"2019-02-28 05:30:02","Erkennst du Fake News?","Wie leicht fallen Menschen auf Fake News rein? Hat ihre politische Einstellung Einfluss darauf, wie leicht sie sich täuschen lassen? Britische Forscher haben sich das genauer angeschaut - doch das Ergebnis wird den meisten nicht gefallen :) Disclaimer: Es handelt sich hier um einen Preprint, das bedeutet, während die Studie durch Peer Review (d.h. durch andere Expert/innen) geprüft wird, machen die Forscher den Volltext hier öffentlich zugänglich: https://psyarxiv.com/ym6t5/ Ich habe mir die Methoden und Auswertungen durchgelesen und zitiere die Ergebnisse hier nach bestem Gewissen. Doch erst nach erfolgreichem Peer Review und eventuellen Anpassungen wird der Preprint als offizielle Studie veröffentlicht. Bildquelle Bill Nye By paul antico - https://www.flickr.com/photos/sfupamr/16788245375/, CC BY 2.0, https://commons.wikimedia.org/w/index.php?curid=46654072 ► maiLab abonnieren: http://bit.ly/2kru8qh ► Instagram: https://www.instagram.com/maithink ► Twitter: https://www.twitter.com/maithi_nk ►YouTube: https://www.youtube.com/funkofficial ►funk Web-App: https://go.funk.net ►Facebook: https://facebook.com/funk ►https://go.funk.net/impressum","Mai,Thi,Nguyen,Kim,Nguyen-Kim,Mai Thi Nguyen-Kim,Quarks,TerraX,Terra X,The Secret Life Of Scientists,Secret Life of Scientists,Fake News,Fake,News,Politik,politisch,rechts,links,Rechte,Linke,Trump,Brexit,Vorurteil,Vorurteile,reinfallen,hereinfallen,erkennen,Nachrichten,Wahrheit,echt",28,"Science & Technology",PT10M34S,634,2d,hd,true,https://i.ytimg.com/vi/cjUDp3-4s14/maxresdefault.jpg,1,452780,21027,,0,3051
67,UCyHDQ5C6z1NDmJ4g6SerW8g,maiLab,keEKlr2dG-I,2019-02-19T12:01:52Z,"2019-02-19 12:01:52","Retten Veganer die Umwelt?","Auf Fleisch und andere tierische Produkte zu verzichten, ist gut für die Umwelt. Heute fragen wir uns: WIE gut eigentlich? ACHTUNG! Bei 9:26 hab ich einen Fehler gemacht: Die Klimaemissionen in den USA entsprechen nicht 7 Millionen Tonnen, sondern ganzen 7 *Milliarden* Tonnen CO2. QUELLEN & WEITERE INFOS Anstieg der Weltbevölkerung: https://population.un.org/wpp/Graphs/Probabilistic/POP/TOT/ Bericht der FAO (Ernährungs- und Landwirtschaftsorganisation der UN): 14,5% der weltweiten menschenverursachten Treibhausgasemissionen gehen aufs Konto der landwirtschaftlichen Tierhaltung http://www.fao.org/news/story/en/item/197623/icode/ Wissenschaftler der FAO setzen die Treibhausgasemissionen von Tierhaltung und Verkehr ins Verhältnis http://news.trust.org/item/20180918083629-d2wf0 LCAs für einzelne Lebensmittel: Der Fußabdruck eines Lebensmittels kann sehr unterschiedlich sein, je nachdem welche Anbaumethoden gewählt wurden, wie es transportiert wurde, in welcher Region es verzehrt wird, usw. Bei der Errechnung von LCAs müssen bestimmte Annahmen gemacht werden, weswegen sich die Werte je nach Quelle deutlich unterscheiden können. Hier LCAs für einige Nahrungsmittel und -kategorien errechnet für Deutschland. Hierher haben wir die Werte für Fleisch und Milchprodukte genommen. T. Meier, O. Christen, 2012, “Gender as a factor in an environmental assessment of the consumption of animal and plant-based foods in Germany”, The International Journal of Life Cycle Assessment, 17 (5): 550-564 https://link.springer.com/article/10.1007/s11367-012-0387-x Weitere LCAs für viele Nahrungsmittel, darunter einzelne Obst- und Gemüsesorten, errechnet für USA. Hierher haben wir die Werte für Avocado, Banane und Apfel genommen (Tabelle in Supplements). M. C. Heller, G. A. Keoleian, 2014, “Greenhouse Gas Emission Estimates of U.S. Dietary Choices and Food Loss”, Journal of Industrial Ecology, 19(3) https://onlinelibrary.wiley.com/doi/abs/10.1111/jiec.12174 Zwei Drittel der weltweiten Weidefläche sind nicht zum Nahrungsmittelanbau geeignet. A. Mottet, C. Haan, A. Falcucci, G. Tempio, C. Opio, P. Gerber, 2017, “Livestock: On our plates or eating at our table? A new analysis of the feed/food debate”, Global Food Security, 14: 1-8 https://www.sciencedirect.com/science/article/abs/pii/S2211912416300013 9% der Treibhausgasemissionen in USA gehen aufs Konto der Landwirtschaft, davon etwa die Hälfte verursacht durch Tierhaltung. Wenn man alle Tiere rausnehmen würde, würde man aber nicht diese ganze Hälfte sparen, sondern nur etwa ein Drittel. R. R. White and M. B. Hall, 2017,”Nutritional and greenhouse gas impacts of removing animals from US agriculture”, PNAS, 114(48): E10301-E10301 https://www.pnas.org/content/114/48/E10301 Würden alle US-Amerikaner sich an die offiziellen Ernährungsempfehlungen Ihres Landes halten, würde das die Treibhausgasemissionen erhöhen - trotz weniger Kalorien UND weniger Fleisch auf dem Teller. Allerdings sind die offiziellen Ernährungsempfehlungen in Deutschland klimafreundlicher, besonders wegen der höheren Mengen an (Vollkorn)Getreide. M. S. Tom, p. S. Fischbeck, C. R. Hendrickson, 2016, “Energy use, blue water footprint, and greenhouse gas emissions for current food consumption patterns and dietary recommendations in the US”, Environ Syst Decis, 36(1): 92-103 https://link.springer.com/article/10.1007/s10669-015-9577-y Treibhausgasemissionen von Gurke mit und ohne Beheizung des Gewächsgauses, von Spargel lokal vs importiert, errechnet für die Schweiz. F. Stoessel, R. Juraske, S. Pfister, S. Hellweg, 2012, Environ Sci Technol, 46(6): 3253–3262. https://www.ncbi.nlm.nih.gov/pmc/articles/PMC3394405/ Treibhausgasemissionen der Ernährungsgewohnheiten echter Personen in Großbritannien. Von über 100 g Fleisch pro Tag auf unter 50 g umsteigen spart pro Jahr etwa die Emissionen eines Flugs nach New York. P. Scarborough, P. N. Appleby, A. Mizdrak, A. D. M. Briggs, R. C. Travis, K. E. Bradbury, T. J. Key, 2014, “Dietary greenhouse gas emissions of meat-eaters, fish-eaters, vegetarians and vegans in the UK”, Climatic Change, 125(2): 179-192 https://link.springer.com/article/10.1007/s10584-014-1169-1 Würden die Schweden landesweit die Hälfte ihres Fleischkonsums durch Hülsenfrüchte ersetzen, könnten sie 20% der ernährungsbedingten Treibhausgasemissionen und 23% der Ackerfläche einsparen. E. Röös, G. Carlsson, F. Ferawati, M. Hefni, A. Stephan, P. Tidåker, C. Witthöft, 2018, “Less meat, more legumes: prospects and challenges in the transition toward sustainable diets in Sweden”, Renewable Agriculture and Food Systems https://www.cambridge.org/core/journals/renewable-agriculture-and-food-systems/article/less-meat-more-legumes-prospects-and-challenges-in-the-transition-toward-sustainable-diets-in-sweden/4B3B9B479B1B407B148D60860F77A088","Vegan,Veganismus,Veganer,Veganerin,Fleisch,Fleischesser,Vegetarier,maiLab,Klimawandel,Umweltbilanz,Umwelt,Fleischlos,Gemüse,Rettung,Mai Thi Nguyen-Kim,Mai,Mai Thi,Tiere,Tiere essen,Essen,Tierische Produkte,Lebensmittel,Ernährung,Nahrung",22,"People & Blogs",PT16M10S,970,2d,hd,true,https://i.ytimg.com/vi/keEKlr2dG-I/maxresdefault.jpg,1,1371385,47832,,0,8287
68,UCyHDQ5C6z1NDmJ4g6SerW8g,maiLab,5jsvTepG2m0,2019-02-15T05:30:00Z,"2019-02-15 05:30:00","Feinstaub & Lungenärzte | Die ganze Wahrheit","Was hat es mit dieser Stellungnahme von rund 100 Lungenärzten auf sich, die vor Kurzem die Diesel-Debatte wieder aktuell machten? Irgendwie ging das aufgeregt durch alle Medien - und 2 Wochen später ist immer noch keine Aufklärung da. Aber irgendwie hat jetzt niemand mehr Lust, weiter darüber zu reden. Zurück bleibt Verwirrung. Deswegen nehmen wir uns hier mal die Zeit - und die Stellungnahme auseinander. Holt euch einen Tee. QUELLEN & WEITERE INFOS “Stellungnahme zur Gesundheitsgefährdung durch umweltbedingte Luftverschmutzung, insbesondere Feinstaub und Stickstoffverbindungen (NOx)” https://bit.ly/2RuXVuS unterschrieben von: https://bit.ly/2EcAd37 Was internationale Experten zur Stellungnahme der Lungenärzte sagen: https://bit.ly/2t3b6t2 Terra X Lesch & Co. - Feinstaub & Stickoxide, Fragen & Antworten: https://youtu.be/9yWM6p4nOM8 Die praktisch relevanten Fragen: Wie sinnvoll sind Dieselfahrverbote überhaupt? Wie gefährlich ist es, in der Stadt Fahrrad zu fahren? Und warum produziert Diesel eigentlich mehr Stickoxide? Alle Antworten und mehr bei Quarks: https://bit.ly/2GLcdWb Übersicht zu Feinstaub & den gesundheitlichen Folgen Umweltbundesamt: https://bit.ly/1UQ7sIZ Science Media Center: https://bit.ly/2DGBRZ8 Übersicht zu Stickoxiden & den gesundheitlichen Folgen Umweltbundesamt: https://bit.ly/1L4XqD2 Science Media Center: https://bit.ly/2SAxp8N Wie entstehen eigentlich die Grenzwerte? https://bit.ly/2BBkust Auch interessant: Was bedeuten eigentlich die verschiedenen Zahlen (Todesfälle, verlorene Lebensjahre etc.)? Wie man Zahlen und Statistik deuten muss: https://bit.ly/2FKybIM Maischberger Sendung zu Diesel, Grenzwerten und Fahrverboten: https://bit.ly/2GO9afU ► maiLab abonnieren: http://bit.ly/2kru8qh ► Instagram: https://www.instagram.com/maithink ► Twitter: https://www.twitter.com/maithi_nk ►YouTube: https://www.youtube.com/funkofficial ►funk Web-App: https://go.funk.net ►Facebook: https://facebook.com/funk ►https://go.funk.net/impressum","Mai,Thi,Nguyen,Kim,Nguyen-Kim,maiLab,Lab,Quarks,TerraX,Terra X,Lesch,Co,Diesel,Abgase,Abgas,Abgaswerte,Grenzwerte,Auto,Dieselautos,Fahrverbote,Dieselverbote,Lungen,Gesundheit,Luft,Luftverschmutzung,Feinstaub,Stickoxide,Stickstoffoxide,Stickoxyd,Stickoxyde,Lungenkrebs,Lungenärzte,Lungenarzt,Rauchen,Dieter Köhler,Kerze,Adventskranz",28,"Science & Technology",PT18M23S,1103,2d,hd,true,https://i.ytimg.com/vi/5jsvTepG2m0/maxresdefault.jpg,1,401096,21981,,0,2622
69,UCyHDQ5C6z1NDmJ4g6SerW8g,maiLab,E1skwOm0lT4,2019-02-08T05:30:00Z,"2019-02-08 05:30:00","Warum ihr NICHT Chemie studieren solltet","3 Gründe gegen ein Chemiestudium. Sind wir doch mal ehrlich. Quelle: https://www.gdch.de/fileadmin/downloads/Ausbildung_und_Karriere/Karriere/Statistik/2017_Statistik_web.pdf Videos, die ich bisher zu Chemiestudium / Ausbildung in der Chemiebranche gemacht habe: Checkliste fürs Chemie-Studium | Was soll ich studieren?: https://youtu.be/yPNZeaye2zc 20 Fragen zum Chemiestudium | Ask A Chemist | Q&A: https://youtu.be/SZSwnbxGvtM Welche Ausbildung passt zu dir? | Chemie: https://youtu.be/4T8iWLTaKdg ► maiLab abonnieren: http://bit.ly/2kru8qh ► Instagram: https://www.instagram.com/maithink ► Twitter: https://www.twitter.com/maithi_nk ►YouTube: https://www.youtube.com/funkofficial ►funk Web-App: https://go.funk.net ►Facebook: https://facebook.com/funk ►https://go.funk.net/impressum","Mai,Thi,Nguyen,Kim,Nguyen-Kim,maiLab,Lab,TerraX,Terra X,Quarks,Chemie,Chemiestudium,Studium,studieren,Ausbildung,Bildung,Tipps,Tips,Uni,Universität,Semester,Labor",28,"Science & Technology",PT8M43S,523,2d,hd,false,https://i.ytimg.com/vi/E1skwOm0lT4/maxresdefault.jpg,1,999886,33901,,0,4064
70,UCyHDQ5C6z1NDmJ4g6SerW8g,maiLab,H9GY49bsp9o,2019-01-31T05:30:01Z,"2019-01-31 05:30:01","Vitamin C & Erkältung - DEBUNKED","Winterzeit, Vitamin-C-Zeit. Aber hilft Vitamin C wirklich gegen Erkältungen? Die Antwort ist: Nicht immer. Alles Weitere im Video. Wie gesagt, schreibt mir mit dem Hashtag #extra in die Kommentare, was für Vitamine oder Nahrungsergänrzungsmittel ihr regelmäßig nehmt oder zu welchen ihr Fragen hättet! Dann gibt’s in Zukunft ein Video dazu. QUELLEN Hier das besagte Cochrane Review: https://bit.ly/2FZA70R Zu den Metaanalysen, die ich im Video erwähne, findet ihr die Forest Plot unter Figure 2 und Figure 3. Es gibt außerdem noch mehr Metaanalysen zu Vitamin C & Erkältung, z.B. ob Vitamin C nicht prophylaktisch, sondern therapeutisch hilft, also ob es was bringt, wenn man Vitamin C erst beginnt zu nehmen, wenn die Erkältung schon ausgebrochen ist (Nein, bist auf eine Studie, bei der die Teilnehmer am ersten Erkältungstag einen Riesenbatzen von 8 Gramm nahmen). Oder ob Erkäktungssymptome gelindert werden können (etwas). Falls euch Englisch nichts ausmacht, schaut gerne mal rein. Ansonsten hier noch eine deutsche Zusammenfassung: https://www.cochrane.de/sites/cochrane.de/files/public/uploads/artikel/01_15_vorbeugung_und_behandlung_einer_erkaeltung_mit_vitamin_c.pdf Bildquelle Linus Pauling Bild: Von US-Gov., Library of Congress, biographical file - www.loc.gov...235_pop.htmlReproduction Number: LC-USZ62-76925PAULING, LINUS, photograph (no date found on item, ca. 1954)Location: Biographical filewww.loc.gov download address, Gemeinfrei, https://commons.wikimedia.org/w/index.php?curid=540732 ► maiLab abonnieren: http://bit.ly/2kru8qh ► Instagram: https://www.instagram.com/maithink ► Twitter: https://www.twitter.com/maithi_nk ►YouTube: https://www.youtube.com/funkofficial ►funk Web-App: https://go.funk.net ►Facebook: https://facebook.com/funk ►https://go.funk.net/impressum","Mai,Thi,Nguyen-Kim,Nguyen Kim,Nguyen,Kim,Mai Thi,maiLab,lab,Quarks,TerraX,Terra X,Lesch,Vitamin C,VitaminC,Vitamin,Vitamine,Erkältung,Erkältungen,erkältet,krank,gesund,Gesundheit,Medizin,Cochrane,Wissen,Wissenschaft,Forest Plot,Forestplot,Forest,Plot,Metaanalyse,Meta-Analyse,Meta,Analyse,Review,Studie,Studien,Wissenschaftliche",28,"Science & Technology",PT7M22S,442,2d,hd,true,https://i.ytimg.com/vi/H9GY49bsp9o/maxresdefault.jpg,1,421349,15378,,0,4319
71,UCyHDQ5C6z1NDmJ4g6SerW8g,maiLab,fPNVnE81lHg,2019-01-24T05:30:02Z,"2019-01-24 05:30:02","Ist ein bisschen Alkohol gesund?","Zu viel Alkohol ist ungesund, klar. Aber was ist mit ein bisschen Alkohol? Ist Alkohol in Maßen gesund - vielleicht sogar gesünder als abstinent zu leben? QUELLEN 01:04 Sabia, Séverine, et al. ""Alcohol consumption and risk of dementia: 23 year follow-up of Whitehall II cohort study."" bmj 362 (2018): k2927. https://www.bmj.com/content/362/bmj.k2927.long 05:12 Wood, Angela M., et al. ""Risk thresholds for alcohol consumption: combined analysis of individual-participant data for 599 912 current drinkers in 83 prospective studies."" The Lancet391.10129 (2018): 1513-1523. https://www.sciencedirect.com/science/article/pii/S014067361830134X 06:14 Berman, Adi Y., et al. ""The therapeutic potential of resveratrol: a review of clinical trials."" NPJ precision oncology 1.1 (2017): 35. https://www.nature.com/articles/s41698-017-0038-6 07:36 Brien, Susan E., et al. ""Effect of alcohol consumption on biological markers associated with risk of coronary heart disease: systematic review and meta-analysis of interventional studies."" Bmj 342 (2011): d636. https://www.bmj.com/content/342/bmj.d636+ ► maiLab abonnieren: http://bit.ly/2kru8qh ► Instagram: https://www.instagram.com/maithink ► Twitter: https://www.twitter.com/maithi_nk ►YouTube: https://www.youtube.com/funkofficial ►funk Web-App: https://go.funk.net ►Facebook: https://facebook.com/funk ►https://go.funk.net/impressum","Mai,Thi,Nguyen,Kim,Nguyen-Kim,mailab,lab,Quarks,The Secret Life Of Scientists,Terra X,TerraX,Lesch,Alkohol,trinken,saufen,bisschen,ein bisschen,Maßen,gesund,ungesund,Gesundheit,Herz,Alzheimer,Demenz,Rotwein,Wein,Bier,Medizin,Wissen,Wissenschaft,Forschung,funk",28,"Science & Technology",PT8M38S,518,2d,hd,true,https://i.ytimg.com/vi/fPNVnE81lHg/maxresdefault.jpg,1,742059,27237,,0,4158
72,UCyHDQ5C6z1NDmJ4g6SerW8g,maiLab,_Ta6BH3e97I,2019-01-17T05:30:01Z,"2019-01-17 05:30:01","GENDER PAY GAP - Die ganze Wahrheit","Oh Gott, nicht schon wieder ein Video zum Gender Pay Gap! Moment, Freunde der Sonne, nicht kotzen - schauen! Das Thema ist vor allem deswegen so nervig, weil es fast immer unvollständig dargestellt wird. Das wollen wir hiermit ändern, also holt euch einen Tee und macht es euch gemütlich. INHALT 00:00 Einführung 01:21 Warum gibt es für den Gender Pay Gap verschiedene Zahlen? 06:12 Welche Zahl ist die richtige? (oder: Was bedeuten die verschiedenen Zahlen genau?) 11:09 Der eigentliche Knackpunkt: Entscheidungsfreiheit 14:12 Ein paar Gedankenanstöße / Eure Meinung QUELLEN & WEITERE INFOS Unbereinigter Gender Pay Gap (2017, Deutschland) = 21%. (Die Zahlen für 2018 werden im März 2019 vom Statistischen Bundesamt veröffentlicht.) Hier die Pressemitteilung vom Statistischen Bundesamt zum Verdienstunterschied zwischen Frauen und Männern: https://www.destatis.de/DE/PresseService/Presse/Pressemitteilungen/2018/03/PD18_099_621.html Homepage Equal Pay Day: https://www.equalpayday.de/startseite/ Bereinigter Gender Pay Gap (2014, Deutschland) = 6%. Hier der ausführliche Bericht zur Ursachenerhebung, die alle 4 Jahre gemacht wird (Die Auswertung für 2018 erscheint 2020): https://www.destatis.de/DE/Publikationen/WirtschaftStatistik/2017/02/Verdienstunterschiede_022017.pdf?__blob=publicationFile Statistisches Bundesamt, Verdienste auf einen Blick, 2017; Hier gibt es noch mehr Infos zu Verdiensten und Unterschieden, nicht nur zwischen Männern und Frauen, sondern z.B. zwischen Angestellten und Selbstständigen uvm. Auf Folie 19 findet ihr die Ursachenerhebung sprich Aufschlüsselung des Gender Pay Gaps, die wir auch ab 03:47 im Video haben: https://www.destatis.de/DE/Publikationen/Thematisch/VerdiensteArbeitskosten/Arbeitnehmerverdienste/BroschuereVerdiensteBlick0160013179004.pdf?__blob=publicationFile Derzeit aktuellste Analyse des Instituts der Deutschen Wirtschaft IW, bereinigter Gender Pay Gap von 3,8%: https://www.iwkoeln.de/studien/iw-kurzberichte/beitrag/entgeltgleichheit-die-gesamtwirtschaftliche-perspektive-welche-ursachen-hat-der-gender-pay-gap-287547.html (2013 ging eine andere, frühere Analyse des IW durch die Presse. Dort wurde ein bereinigter Gender Pay von unter 2% berechnet, allerdings nur bei Frauen, die weniger als ein halbes Jahr Elternzeit nahmen. Das IW hat uns bestätigt, dass der oben verlinkte Kurzbericht die aktuellste Analyse enthält.) Die Jennifer vs. John Studie: https://www.pnas.org/content/pnas/109/41/16474.full.pdf Kurze Anmerkung zur Einordnung: Ich finde diese Studie deshalb so interessant, weil sie eine der wenigen Studien ist, die methodisch so stark ist. Das experimentelle Setup ermöglichte es, dass ein einziger Parameter verändert werden konnte (Jennifer vs. John), während alles andere gleich blieb. Es gibt etliche Studien zu allgemeinen Unterschieden zwischen Frauen und Männern im Bezug auf Beruf und Erfolg, die auch sehr interessant sind - doch methodisch meist nicht so stark, dass man daraus praktischer Schlüsse für den Gender Pay Gap ziehen könnte. Hier ein Beispiel auf deutsch zu Genderunterschieden bei Gehaltsverhandlungen: https://bit.ly/2RX7xms Auch für das Beispiel Risikobereitschaft, das ich im Video nenne, gibt es mehrere wissenschaftliche Hinweise darauf, dass Männer risikobereiter sind, z.B.: https://bit.ly/2FvcWuZ Doch es ist fast unmöglich, solche Charaktereigenschaften quantitativ den Verdienstunterschieden zuzuschreiben. Man kann nur sagen: Gut möglich, dass sie eine Rolle spielen, aber keine Ahnung wie viel. Unterm Strich - ob Diskriminierung, Genderunterschiede oder andere Gründe: Wir können bisher nur spekulieren. Der bereinigte Gender Pay Gap ist ein unerklärter Gender Pay Gap und wir brauchen noch mehr Aufklärung. ► maiLab abonnieren: http://bit.ly/2kru8qh ► Instagram: https://www.instagram.com/maithink ► Twitter: https://www.twitter.com/maithi_nk ►YouTube: https://www.youtube.com/funkofficial ►funk Web-App: https://go.funk.net ►Facebook: https://facebook.com/funk ►https://go.funk.net/impressum","Mai,Thi,Nguyen,Kim,Nguyen-Kim,Quarks,TerraX,Terra X,Lesch,maiLab,Lab,Gender Pay Gap,Gender,Pay,Gap,Lohn,Gehalt,Lücke,Lohnlücke,Verdienst,Verdienstlücke,Geld,verdienen,Arbeit,Männer,Frauen,Geschlecht,Diskriminierung,Equal Pay Day,Statistik,Wahrheit,Wissen,Wissenschaft,Statistisches Bundesamt,Zahlen,Bereinigter,unbereinigter,bereinigter Gender Pay Gap,unbereinigter Gender Pay Gap,Co,Unterschied,Unterschiede,Ursachen,Gründe,Begründungen",28,"Science & Technology",PT15M47S,947,2d,hd,false,https://i.ytimg.com/vi/_Ta6BH3e97I/maxresdefault.jpg,1,875014,42643,,0,6173
